text,reviewId,url,placeId,categoryName,stars,title,reviewImageUrls/0,genre
The atmosphere took me right back home. The food was delicious. The prices were average. The Pilsner beer was amazing. Every Wednesday is Buffet night with different food choices on the bar each week. Follow them on Facebook for their Menu. Homesickness was cured.....until next week 😉🇺🇸🇩🇪,ChdDSUhNMG9nS0VJQ0FnSUNLOE1PVHZRRRAB,"https://www.google.com/maps/place/Edelweiss+Restaurant/@39.7917795,-86.6888612,10z/data=!4m6!3m5!1s0x886b5c3af1539301:0x66ec4f175711e00c!8m2!3d39.6407909!4d-86.1609662!16s%2Fg%2F1tfzhhyv?hl=en",ChIJAZNT8Tpca4gRDOARVxdP7GY,German restaurant,5.0,Edelweiss Restaurant,https://lh5.googleusercontent.com/p/AF1QipNuKQMCb29BAlwkpyH0676D8rUw0zFAGw86Mt4Q=w150-h150-k-no-p,restaurant
"1st 2 items I ordered,  they came back and told me they were out of them. The weiner schnitzel however,  was very good and the waitress was nice.",ChZDSUhNMG9nS0VJQ0FnSUNLNlktZmN3EAE,"https://www.google.com/maps/place/Edelweiss+Restaurant/@39.7917795,-86.6888612,10z/data=!4m6!3m5!1s0x886b5c3af1539301:0x66ec4f175711e00c!8m2!3d39.6407909!4d-86.1609662!16s%2Fg%2F1tfzhhyv?hl=en",ChIJAZNT8Tpca4gRDOARVxdP7GY,German restaurant,3.0,Edelweiss Restaurant,https://lh5.googleusercontent.com/p/AF1QipMmkqDM8PlvoEmArv72CTuulDGk9PQkjFDZdOKe=w150-h150-k-no-p,restaurant
"Amazing german food and wine, excellent service, and inlove all the German pictures, videos, maps, artifacts and decorations. This is our favorite restaurant for family celebrations.",ChdDSUhNMG9nS0VJQ0FnSUNCbTRxb3V3RRAB,"https://www.google.com/maps/place/Edelweiss+Restaurant/@39.7917795,-86.6888612,10z/data=!4m6!3m5!1s0x886b5c3af1539301:0x66ec4f175711e00c!8m2!3d39.6407909!4d-86.1609662!16s%2Fg%2F1tfzhhyv?hl=en",ChIJAZNT8Tpca4gRDOARVxdP7GY,German restaurant,5.0,Edelweiss Restaurant,https://lh5.googleusercontent.com/p/AF1QipMFVd5QDff9U-ANNO16DWnLqnc8ZoVi2LepeW7-=w150-h150-k-no-p,restaurant
Chicken dance,ChZDSUhNMG9nS0VJQ0FnSURVOV9qdURBEAE,"https://www.google.com/maps/place/Edelweiss+Restaurant/@39.7917795,-86.6888612,10z/data=!4m6!3m5!1s0x886b5c3af1539301:0x66ec4f175711e00c!8m2!3d39.6407909!4d-86.1609662!16s%2Fg%2F1tfzhhyv?hl=en",ChIJAZNT8Tpca4gRDOARVxdP7GY,German restaurant,5.0,Edelweiss Restaurant,https://lh5.googleusercontent.com/p/AF1QipMHhGNN9PMb1QNUQ1SKXfiRIcLLLPa2dDGZDyE6=w150-h150-k-no-p,restaurant
Great food and service the place is in the basement will be returning for sure to try what i didn't this time !!!!,ChZDSUhNMG9nS0VJQ0FnSUNJMnNLekpnEAE,"https://www.google.com/maps/place/Edelweiss+Restaurant/@39.7917795,-86.6888612,10z/data=!4m6!3m5!1s0x886b5c3af1539301:0x66ec4f175711e00c!8m2!3d39.6407909!4d-86.1609662!16s%2Fg%2F1tfzhhyv?hl=en",ChIJAZNT8Tpca4gRDOARVxdP7GY,German restaurant,5.0,Edelweiss Restaurant,https://lh5.googleusercontent.com/p/AF1QipOsgbrFtE_IMuugObKCrfZ9VSLLYYeOzxWuvThH=w150-h150-k-no-p,restaurant
"Delicious!
Do yourself a favor and order a big bowl of the haus soup!
The cabbage is fantastic. The pork chops were huge and perfectly done.
Portions are enormous
Wish I had room for dessert!",ChZDSUhNMG9nS0VJQ0FnSUNoa1B1OEV3EAE,"https://www.google.com/maps/place/Edelweiss+Restaurant/@39.7917795,-86.6888612,10z/data=!4m6!3m5!1s0x886b5c3af1539301:0x66ec4f175711e00c!8m2!3d39.6407909!4d-86.1609662!16s%2Fg%2F1tfzhhyv?hl=en",ChIJAZNT8Tpca4gRDOARVxdP7GY,German restaurant,5.0,Edelweiss Restaurant,https://lh5.googleusercontent.com/p/AF1QipNiFxWRSzsZ-bI8gucMGfqyQeOgJau05x8SGNnS=w150-h150-k-no-p,restaurant
"Awesome food and fantastic service, try the Curry Wurst. Also had the Ruben and pretzel.",ChZDSUhNMG9nS0VJQ0FnSURXdjRDN0J3EAE,"https://www.google.com/maps/place/Edelweiss+Restaurant/@39.7917795,-86.6888612,10z/data=!4m6!3m5!1s0x886b5c3af1539301:0x66ec4f175711e00c!8m2!3d39.6407909!4d-86.1609662!16s%2Fg%2F1tfzhhyv?hl=en",ChIJAZNT8Tpca4gRDOARVxdP7GY,German restaurant,5.0,Edelweiss Restaurant,https://lh5.googleusercontent.com/p/AF1QipOtPFOOwWO0w1_ugIZzJvcTWaY_UMCQcFHOZg9e=w150-h150-k-no-p,restaurant
"This place is amazing.  Talk about taking yourself back in time for a minute you feel like you are in Germany.  They open at 5pm for dinner only.  You drive down this  dark road, and you would never know there was a parking lot and a restaurant from the top of the road.
You go inside from the parking lot on a top level,  down a flight of  stairs is the restaurant.  They do have an elevator for handicap.
Once below it's amazing.  It's small probably about 30 tables, wooden walls, and all decorated with Germany memorabilia.
I was so excited to try this place the last time I had German food was in Germany 20 plus years ago.  I still remember what that tasted like.
There was 2 waitress serving and taking orders. Lisa was our waitress.  She is such a nice lady,  and definitely knows her menu,  and has worked their for a long time.  I ordered the German beer on tap it was very light, clear, and refreshing. My other half Bayrischer Schweinebraten it was a tender slow roasted pork shoulder.  I tasted the dish and it was amazing.  Very tender and with lots of flavor.  It was not sliced it was more like chunk pork. His side was the sliced apples.  I have never tried apples sliced fresh, in a cinnamon sauce.  I wish you could order this by the pint or quart to take home.  Amazing!
I ordered Jägerschnitzel which was delicious with the cream white wine sauce, and mushroom.  The sauce was so good I asked for a little more sauce. The pork meat was tender, and a nice slice. My sides was potato pancakes oh my goodness hold the fork these were not greasy at all.  I put the sour cream and applesauce on the potato cakes. My other side I was wanting to try was the German potato salad.  It was good, completely traditional,  but not my favorite for my taste buds. Before dinner you have a choice of soup or salad.  I definitely tried the soup which was really good the traditional red cabbage soup.
I can't wait to come back to try more dishes.
For dessert if you have room definitely order the bread pudding with the warm whiskey sauce.  You will want to make room for this dessert.
We were getting ready to leave, they were closing, and they were so nice they make everything fresh daily, and had extra apple and cherry turnovers. I had taken home 1 of each. The next day with a cup of coffee, warmed up,  very good.
I can't wait to come back!
Thank you ladies for such a great experience.",ChZDSUhNMG9nS0VJQ0FnSUNXbDdlaVB3EAE,"https://www.google.com/maps/place/Edelweiss+Restaurant/@39.7917795,-86.6888612,10z/data=!4m6!3m5!1s0x886b5c3af1539301:0x66ec4f175711e00c!8m2!3d39.6407909!4d-86.1609662!16s%2Fg%2F1tfzhhyv?hl=en",ChIJAZNT8Tpca4gRDOARVxdP7GY,German restaurant,5.0,Edelweiss Restaurant,https://lh5.googleusercontent.com/p/AF1QipPM7yRkFwt4f0TiBq_mxetotyq017lXd3KF5cFv=w150-h150-k-no-p,restaurant
"Wonderful charm, kind staff, amazing food!! Will be back for more!",ChZDSUhNMG9nS0VJQ0FnSUN1ekxUQ0NnEAE,"https://www.google.com/maps/place/Edelweiss+Restaurant/@39.7917795,-86.6888612,10z/data=!4m6!3m5!1s0x886b5c3af1539301:0x66ec4f175711e00c!8m2!3d39.6407909!4d-86.1609662!16s%2Fg%2F1tfzhhyv?hl=en",ChIJAZNT8Tpca4gRDOARVxdP7GY,German restaurant,5.0,Edelweiss Restaurant,https://lh5.googleusercontent.com/p/AF1QipN-xKjtDsEVD2USfiPcmD4kboBST_k_s7fupYHw=w150-h150-k-no-p,restaurant
"The food here was absolutely terrific! Some places offer homestyle dishes like your mom used to make. This place offers homestyle dishes like someone else's mom made, and they're all delicious. My favorite was the shepherds pie, but everything they served was great. Wednesday nights are ""buffeteria"" style. They serve you like a cafeteria but you keep going back until you're finished. Non-members price was $16.95 which I felt was fair for the quality of food and service provided. If you want to try something a little out of the ordinary I highly recommend a Edelweiss! I'll certainly be back when I cost the area again. Call ahead reservations are recommended.",ChdDSUhNMG9nS0VJQ0FnSUNPejl2amd3RRAB,"https://www.google.com/maps/place/Edelweiss+Restaurant/@39.7917795,-86.6888612,10z/data=!4m6!3m5!1s0x886b5c3af1539301:0x66ec4f175711e00c!8m2!3d39.6407909!4d-86.1609662!16s%2Fg%2F1tfzhhyv?hl=en",ChIJAZNT8Tpca4gRDOARVxdP7GY,German restaurant,5.0,Edelweiss Restaurant,https://lh5.googleusercontent.com/p/AF1QipPiyoMTdUmV2gPcfo-SFS9TR_LBYjRrQgaiOo6B=w150-h150-k-no-p,restaurant
"Finally there is a fine dining restaurant in B-town. Seasonal menu with creative ideas, healthy & tasty food, and cool vibe, love it.",ChZDSUhNMG9nS0VJQ0FnSURPdkliZ0dnEAE,"https://www.google.com/maps/place/The+Elm+Restaurant/@39.1611609,-86.7899909,11z/data=!4m6!3m5!1s0x886c6708d507ad07:0x637ac7c0df7ee644!8m2!3d39.1611609!4d-86.526319!16s%2Fg%2F11pctwtx_4?hl=en",ChIJB60H1QhnbIgRROZ-38DHemM,Restaurant,5.0,The Elm Restaurant,https://lh5.googleusercontent.com/p/AF1QipP6cpexp0mXZhwjkp7ciLTGtb5xRg-6eBMioobX=w150-h150-k-no-p,restaurant
"I couldn't have asked for a nicer birthday dinner. The staff were lovely (thanks, Tam), the interior has a beautiful modern, earthy vibe, and the food was great. I especially liked the matcha creme brulee, baby beet salad, harissa cauliflower, and salted pistachio latte. We're so excited something is finally in this space again.",ChZDSUhNMG9nS0VJQ0FnSURXX2VmamV3EAE,"https://www.google.com/maps/place/The+Elm+Restaurant/@39.1611609,-86.7899909,11z/data=!4m6!3m5!1s0x886c6708d507ad07:0x637ac7c0df7ee644!8m2!3d39.1611609!4d-86.526319!16s%2Fg%2F11pctwtx_4?hl=en",ChIJB60H1QhnbIgRROZ-38DHemM,Restaurant,5.0,The Elm Restaurant,https://lh5.googleusercontent.com/p/AF1QipNgLt8I7-9PvP7uOufWmnfUgtAJcSPiWE8vFZ5v=w150-h150-k-no-p,restaurant
"Great service, and the chicken sandwich and freshly baked bread was delicious.  We also enjoyed the drink selection.  Glad that there is excellent bike parking at the restaurant, which we appreciated",ChZDSUhNMG9nS0VJQ0FnSURPNTVqX0Z3EAE,"https://www.google.com/maps/place/The+Elm+Restaurant/@39.1611609,-86.7899909,11z/data=!4m6!3m5!1s0x886c6708d507ad07:0x637ac7c0df7ee644!8m2!3d39.1611609!4d-86.526319!16s%2Fg%2F11pctwtx_4?hl=en",ChIJB60H1QhnbIgRROZ-38DHemM,Restaurant,5.0,The Elm Restaurant,https://lh5.googleusercontent.com/p/AF1QipNZhUpeg7A_Q28N70LgtVd2BZSdWNuv-sFbOewI=w150-h150-k-no-p,restaurant
"Superb food, great presentation, good service, great location, and a nice ambiance.  One of the top two in Bloomington.  The vegan charcuterie was really good and inventive.  The duck breast was just right and a colorful presentation.",ChZDSUhNMG9nS0VJQ0FnSURPdWNDNkdREAE,"https://www.google.com/maps/place/The+Elm+Restaurant/@39.1611609,-86.7899909,11z/data=!4m6!3m5!1s0x886c6708d507ad07:0x637ac7c0df7ee644!8m2!3d39.1611609!4d-86.526319!16s%2Fg%2F11pctwtx_4?hl=en",ChIJB60H1QhnbIgRROZ-38DHemM,Restaurant,5.0,The Elm Restaurant,https://lh5.googleusercontent.com/p/AF1QipNxTzfAhy5g5IrcRZHla1ChKEOG7rQVuSeUxmMo=w150-h150-k-no-p,restaurant
Fantastic experience. We felt comfortable  the moment we got there. Our cocktails were very good and the food was delicious. For just getting started they are already at or above most places in town. The team in the kitchen is made up of local celebrity chefs. It’s great to see so much talent under one roof. Can’t wait to see what they put out once they truly hit their stride.,ChdDSUhNMG9nS0VJQ0FnSURXNF9XMHBnRRAB,"https://www.google.com/maps/place/The+Elm+Restaurant/@39.1611609,-86.7899909,11z/data=!4m6!3m5!1s0x886c6708d507ad07:0x637ac7c0df7ee644!8m2!3d39.1611609!4d-86.526319!16s%2Fg%2F11pctwtx_4?hl=en",ChIJB60H1QhnbIgRROZ-38DHemM,Restaurant,5.0,The Elm Restaurant,https://lh5.googleusercontent.com/p/AF1QipNZhWKGTvP4xZDF3F73D2yilgo1hj_ZYdvMOA4s=w150-h150-k-no-p,restaurant
"Wow! Excellent,  fresh and lovely prepared seasonal food. We are so happy to have this little gem in our neighborhood. If you haven't stopped in yet put it on your to do list!!",ChZDSUhNMG9nS0VJQ0FnSUMyeWM3bU1BEAE,"https://www.google.com/maps/place/The+Elm+Restaurant/@39.1611609,-86.7899909,11z/data=!4m6!3m5!1s0x886c6708d507ad07:0x637ac7c0df7ee644!8m2!3d39.1611609!4d-86.526319!16s%2Fg%2F11pctwtx_4?hl=en",ChIJB60H1QhnbIgRROZ-38DHemM,Restaurant,5.0,The Elm Restaurant,https://lh5.googleusercontent.com/p/AF1QipO9uFibPSMyDEeZQt83CgEh5pfqIwfu9xgKzf4=w150-h150-k-no-p,restaurant
"Absolutely smashing food and amazing drinks. Bailey, our bartender, was the absolute best. Do check this place out! This place is definitely one of Bloomington's best!",ChdDSUhNMG9nS0VJQ0FnSUMydnVmOTh3RRAB,"https://www.google.com/maps/place/The+Elm+Restaurant/@39.1611609,-86.7899909,11z/data=!4m6!3m5!1s0x886c6708d507ad07:0x637ac7c0df7ee644!8m2!3d39.1611609!4d-86.526319!16s%2Fg%2F11pctwtx_4?hl=en",ChIJB60H1QhnbIgRROZ-38DHemM,Restaurant,5.0,The Elm Restaurant,https://lh5.googleusercontent.com/p/AF1QipMbVG9MHMaWwthkvG4ovd_JUhqohjFAxYwYPS8c=w150-h150-k-no-p,restaurant
"My wife and I originally booked a reservation for 8pm on a Friday night but decided to come an hour early to see if we could sit at the bar for a couple of drinks first.

We ended up staying at the lower bar and eating a wonderful dinner. Mostly because of our bartender’s kindness, professionalism and the great ambiance.

Mushroom kushiyaki and charred avocado for a starter. Then, egg yolk raviolo and chicken roulade for our main course. Delicious on all counts.

It’s set up as a cafe, as well. We didn’t experience this side of it. But, highly recommend if you’re looking for a nice dinner in Bloomington.",ChdDSUhNMG9nS0VJQ0FnSUNoazhHaG1nRRAB,"https://www.google.com/maps/place/The+Elm+Restaurant/@39.1611609,-86.7899909,11z/data=!4m6!3m5!1s0x886c6708d507ad07:0x637ac7c0df7ee644!8m2!3d39.1611609!4d-86.526319!16s%2Fg%2F11pctwtx_4?hl=en",ChIJB60H1QhnbIgRROZ-38DHemM,Restaurant,5.0,The Elm Restaurant,https://lh5.googleusercontent.com/p/AF1QipNxTaOUsYVMzeyEvWkf9KeDQHXDbz6u1oxAErmj=w150-h150-k-no-p,restaurant
"We stumbled to this restaurant by accident when we were looking for a place for dinner after 8 pm. Their host was kind to find us a table right away and our table services were remarkable. We loved each dishes they introduced us to and were surprised by some innovations of the chef. Each dishes looked well presented, not too crafty, but once you taste them, you will keep on eating until you finished all of them. This was the first time and first night we visited Bloomington, and we are grateful we have this experience to remember this trip.",ChdDSUhNMG9nS0VJQ0FnSUR1NlA3YWlBRRAB,"https://www.google.com/maps/place/The+Elm+Restaurant/@39.1611609,-86.7899909,11z/data=!4m6!3m5!1s0x886c6708d507ad07:0x637ac7c0df7ee644!8m2!3d39.1611609!4d-86.526319!16s%2Fg%2F11pctwtx_4?hl=en",ChIJB60H1QhnbIgRROZ-38DHemM,Restaurant,5.0,The Elm Restaurant,https://lh5.googleusercontent.com/p/AF1QipMaRxLfTClh4njYphZKJ8TShHpaKWBO_SyEarJC=w150-h150-k-no-p,restaurant
"I want to begin by saying I really love the atmosphere. The tables are spaced out enough that there is not much noise and it’s easy to talk to your table. The interior decoration is also very beautiful. There is not much parking but I live close so I walked. The food was delicious but there were just enough weird things that made me give 4 instead of 5 stars. The bread and butter (which is its own appetizer) is OK but definitely not anything to write home about, the butter pat was cold so not easily spreadable. I ordered the cauliflower main dish with sauce and golden raisins knowing it would be lighter than a meat main. However, with the price of the dish, I was expecting a bit more than 1/4 of a cauliflower head for my main meal. I know inflation and prices are high but cauliflower? Seems they could’ve spared a bit more. Additionally the olive oil cake with rhubarb and strawberry ice cream was good but the ice cream stole the show! The cake itself was just ok and the rhubarb had not been sweetened enough to make it palatable, I ended up taking it off. The service was good but not great, we had a new server and she made a few missteps that ultimately would have cost our party money if we hadn’t spoken up (as opposed to slow service, etc). Overall, I definitely want to go back to the elm, i will just choose my dishes more carefully.",ChZDSUhNMG9nS0VJQ0FnSUQyX1AyLVd3EAE,"https://www.google.com/maps/place/The+Elm+Restaurant/@39.1611609,-86.7899909,11z/data=!4m6!3m5!1s0x886c6708d507ad07:0x637ac7c0df7ee644!8m2!3d39.1611609!4d-86.526319!16s%2Fg%2F11pctwtx_4?hl=en",ChIJB60H1QhnbIgRROZ-38DHemM,Restaurant,4.0,The Elm Restaurant,https://lh5.googleusercontent.com/p/AF1QipOoW89ePePoKhRoJQIukaMmy8uanpBy-oEo6kr-=w150-h150-k-no-p,restaurant
Great exhibition,ChdDSUhNMG9nS0VJQ0FnSURPdHNyOG1RRRAB,"https://www.google.com/maps/place/Paintball+Paradise+-+Indoor+%26+Outdoor+Paintball+Park+%26+Store/@46.2975773,-113.3616738,5z/data=!4m6!3m5!1s0x52ea6fe5a4da2b0b:0x2273c2b2f8836c93!8m2!3d49.9755119!4d-97.0840676!16s%2Fg%2F1tg9mswt?hl=en",ChIJCyvapOVv6lIRk2yD-LLCcyI,Paintball center,5.0,Paintball Paradise - Indoor & Outdoor Paintball Park & Store,https://lh5.googleusercontent.com/p/AF1QipOVTO99HrGT2Pb0EMd7aUiVrNhzlYdZmAazR508=w150-h150-k-no-p,activity
"Kids had a blast for their bday party. Staff are super knowledgable and awesome with the kids, it wasn't our ""cheapest"" party but definitely worth it. We spent about $450 or so but that was for 9 kids and myself, 4 pizzas, drinks, coverall rentals, guns ( they deal with the CO2) masks and we bought 100 extra paintballs.  Birthday boy gets a free gun upgrade. You can get almost 3 hours if you ration paintballs properly.  Its been a couple weeks and the kids are still talking about it.",ChZDSUhNMG9nS0VJQ0FnSUNnN0xMRkdREAE,"https://www.google.com/maps/place/Paintball+Paradise+-+Indoor+%26+Outdoor+Paintball+Park+%26+Store/@46.2975773,-113.3616738,5z/data=!4m6!3m5!1s0x52ea6fe5a4da2b0b:0x2273c2b2f8836c93!8m2!3d49.9755119!4d-97.0840676!16s%2Fg%2F1tg9mswt?hl=en",ChIJCyvapOVv6lIRk2yD-LLCcyI,Paintball center,5.0,Paintball Paradise - Indoor & Outdoor Paintball Park & Store,https://lh5.googleusercontent.com/p/AF1QipOMWXKgRxWwpLHst43CZMecYwXaUfA4Y2SaFQA0=w150-h150-k-no-p,activity
good for party,ChdDSUhNMG9nS0VJQ0FnSURoa2NqZjBBRRAB,"https://www.google.com/maps/place/Paintball+Paradise+-+Indoor+%26+Outdoor+Paintball+Park+%26+Store/@46.2975773,-113.3616738,5z/data=!4m6!3m5!1s0x52ea6fe5a4da2b0b:0x2273c2b2f8836c93!8m2!3d49.9755119!4d-97.0840676!16s%2Fg%2F1tg9mswt?hl=en",ChIJCyvapOVv6lIRk2yD-LLCcyI,Paintball center,5.0,Paintball Paradise - Indoor & Outdoor Paintball Park & Store,https://lh5.googleusercontent.com/p/AF1QipOqrr2dvhAwnqoRDSQ-OPCcF9-dhOfbrRwCIp_8=w150-h150-k-no-p,activity
Had a great time!,ChdDSUhNMG9nS0VJQ0FnSUNnMXZ6SXlRRRAB,"https://www.google.com/maps/place/Paintball+Paradise+-+Indoor+%26+Outdoor+Paintball+Park+%26+Store/@46.2975773,-113.3616738,5z/data=!4m6!3m5!1s0x52ea6fe5a4da2b0b:0x2273c2b2f8836c93!8m2!3d49.9755119!4d-97.0840676!16s%2Fg%2F1tg9mswt?hl=en",ChIJCyvapOVv6lIRk2yD-LLCcyI,Paintball center,4.0,Paintball Paradise - Indoor & Outdoor Paintball Park & Store,https://lh5.googleusercontent.com/p/AF1QipPsM3dmJtZH-A7myuGQ2a11yZ15WjjPLr4Bki8z=w150-h150-k-no-p,activity
My 10 year old son and I had an absolute blast!! We had so much fun the staff was so friendly and helpful we got to play 3 different fields and there is even a target range to try out your accuracy we culd not be happier with our time hear and will definitely be back meany more times,ChZDSUhNMG9nS0VJQ0FnSUNldTcyU013EAE,"https://www.google.com/maps/place/Paintball+Paradise+-+Indoor+%26+Outdoor+Paintball+Park+%26+Store/@46.2975773,-113.3616738,5z/data=!4m6!3m5!1s0x52ea6fe5a4da2b0b:0x2273c2b2f8836c93!8m2!3d49.9755119!4d-97.0840676!16s%2Fg%2F1tg9mswt?hl=en",ChIJCyvapOVv6lIRk2yD-LLCcyI,Paintball center,5.0,Paintball Paradise - Indoor & Outdoor Paintball Park & Store,https://lh5.googleusercontent.com/p/AF1QipMgCXWcUPtM11Sy2Lgy9q5oR6-UErgNwycTOC8M=w150-h150-k-no-p,activity
I have a Room on the bottom floor and I like it because I can see my car out the window. Also when I got into the Room it was really clean and smelled great. Everything in the Room is lovely there is a refrigerator freezer and microwave. They also have a coffee maker and a nice flat screen TV. Plenty of light in here and also plenty of plug INS I can't tell you how important light and plug INS are to me. I will definitely stay here again! Also they are pet friendly!,ChdDSUhNMG9nS0VJQ0FnSUQ0MF83TXhRRRAB,"https://www.google.com/maps/place/Quality+Inn+%26+Suites+Elko/@38.1399101,-128.4934264,6z/data=!4m9!3m8!1s0x80a601246993770f:0x33c73540b526e513!5m2!4m1!1i2!8m2!3d40.855877!4d-115.740533!16s%2Fg%2F1tgwsj2j?hl=en",ChIJD3eTaSQBpoARE-UmtUA1xzM,Hotel,5.0,Quality Inn & Suites Elko,https://lh5.googleusercontent.com/p/AF1QipMA15RRIXwxvXe056T9Uc-1DX36yxLUgiZ_97Lv=w150-h150-k-no-p,hotel
"We were just passing through and come across this gem of a hotel. Great price, Nice clean rooms, great hot breakfast. The hospitality was amazing. Pet friendly and understanding of our 2 dogs that don't really care for other people or animals and bark when they see them. An amazing big off leash dog run behind the hotel. I would recommend this hotel to anyone traveling with pets and anyone else looking for a quite clean place to stay.",ChZDSUhNMG9nS0VJQ0FnSUQ4cDkyaExBEAE,"https://www.google.com/maps/place/Quality+Inn+%26+Suites+Elko/@38.1399101,-128.4934264,6z/data=!4m9!3m8!1s0x80a601246993770f:0x33c73540b526e513!5m2!4m1!1i2!8m2!3d40.855877!4d-115.740533!16s%2Fg%2F1tgwsj2j?hl=en",ChIJD3eTaSQBpoARE-UmtUA1xzM,Hotel,5.0,Quality Inn & Suites Elko,https://lh5.googleusercontent.com/p/AF1QipNStlXMlZcxJ5dFXglQnbBmKgSbSwKnSiKvXFi6=w150-h150-k-no-p,hotel
"The FULL, hot breakfast is great here! Its a rarity to find a breakfast like this these days. There were many many options. Something for every family member and saved our family of four at least $30 had we gotten it as a restaurant. So if you take that into account with the price of the hotel staying was very affordable! Clean hotel. As a Mom, I couldn't give a hotel without a pool for the kids more than four stars. Also, the bathroom in our room needs a new toilet seat and a new shower head. Over all very happy we stayed here. ***If you liked my review or found it to be helpful give it a thumbs up. 👍 thanks!",ChZDSUhNMG9nS0VJQ0FnSUNDM3J5dER3EAE,"https://www.google.com/maps/place/Quality+Inn+%26+Suites+Elko/@38.1399101,-128.4934264,6z/data=!4m9!3m8!1s0x80a601246993770f:0x33c73540b526e513!5m2!4m1!1i2!8m2!3d40.855877!4d-115.740533!16s%2Fg%2F1tgwsj2j?hl=en",ChIJD3eTaSQBpoARE-UmtUA1xzM,Hotel,4.0,Quality Inn & Suites Elko,https://lh5.googleusercontent.com/p/AF1QipMei6DNTxTim68Gs9fCj5hm4g653VPTRa-cwXpq=w150-h150-k-no-p,hotel
"This IS the best value in Elko! The room was $60 and some change and I cant say enough about them!
Room was clean and modern. There was a tub, which is ALWAYS a plus. Hotel was quiet and well stocked. (See photos)
But the number one thing about Quality Inn and Suites was the above and beyond Customer Service. The young lady was polite, thoughtful enough to put my Pooch close to the dog park out back amongst other things.",ChZDSUhNMG9nS0VJQ0FnSUN5b2JEOExnEAE,"https://www.google.com/maps/place/Quality+Inn+%26+Suites+Elko/@38.1399101,-128.4934264,6z/data=!4m9!3m8!1s0x80a601246993770f:0x33c73540b526e513!5m2!4m1!1i2!8m2!3d40.855877!4d-115.740533!16s%2Fg%2F1tgwsj2j?hl=en",ChIJD3eTaSQBpoARE-UmtUA1xzM,Hotel,5.0,Quality Inn & Suites Elko,https://lh5.googleusercontent.com/p/AF1QipOC_SXcZ4PXwqBU_xWRg2Uy7xWkjSS9qVBx2VTI=w150-h150-k-no-p,hotel
Quick visit. Huge gaming floor. Lots of excitement. Could be better if they offered on-floor servers for those gambling who don't want to lose their machine.,ChdDSUhNMG9nS0VJQ0FnSUNzdl9ldjlnRRAB,"https://www.google.com/maps/place/Mardi+Gras+Casino+%26+Resort/@35.8076728,-90.2479862,6z/data=!4m2!3m1!1s0x8848cba4893b5411:0xe687c321e466648c?hl=en",ChIJEVQ7iaTLSIgRjGRm5CHDh-Y,Casino,3.0,Mardi Gras Casino & Resort,https://lh5.googleusercontent.com/p/AF1QipN8Rg83JETHOy7sNBCkiO2aPjqznQDcOo4RB2kP=w150-h150-k-no-p,hotel
Been a few years since I been here and seems like business has slowed down even more. This place has never really been busy since when I used to come here in first place. Poker room barely had 1 to 2 tables open in the past and 1 craps table. Today Poker room is closed for the next few days and craps closed too. One thing I'll say is the Cafe has some pretty good food. Can never go wrong with the burger.,ChdDSUhNMG9nS0VJQ0FnSUNPaUl6dGpnRRAB,"https://www.google.com/maps/place/Mardi+Gras+Casino+%26+Resort/@35.8076728,-90.2479862,6z/data=!4m2!3m1!1s0x8848cba4893b5411:0xe687c321e466648c?hl=en",ChIJEVQ7iaTLSIgRjGRm5CHDh-Y,Casino,2.0,Mardi Gras Casino & Resort,https://lh5.googleusercontent.com/p/AF1QipMH3L0psVfVnCiZTPwdSgPXj45iWSi9XZ0W8uTk=w150-h150-k-no-p,hotel
Great Place To Play With Really Fun Games and Really Big Payouts and you can change the .01 cent games to .02 cent games and when you do that your winnings are double as well!! I hit great betting .02 cent and max bet 10.00 a spin.. Give it a try and you will see what I mean!! Can't wait to go back!!,ChZDSUhNMG9nS0VJQ0FnSURTdGVfNlNnEAE,"https://www.google.com/maps/place/Mardi+Gras+Casino+%26+Resort/@35.8076728,-90.2479862,6z/data=!4m2!3m1!1s0x8848cba4893b5411:0xe687c321e466648c?hl=en",ChIJEVQ7iaTLSIgRjGRm5CHDh-Y,Casino,5.0,Mardi Gras Casino & Resort,https://lh5.googleusercontent.com/p/AF1QipMkWhOhcuqma88stZVWUl7iss9BEyyL4_LTeGJ7=w150-h150-k-no-p,hotel
Excellent place staff was amazing really enjoyed are weekend there. We will definitely return .,ChZDSUhNMG9nS0VJQ0FnSURBNWZyaUpBEAE,"https://www.google.com/maps/place/Mardi+Gras+Casino+%26+Resort/@35.8076728,-90.2479862,6z/data=!4m2!3m1!1s0x8848cba4893b5411:0xe687c321e466648c?hl=en",ChIJEVQ7iaTLSIgRjGRm5CHDh-Y,Casino,5.0,Mardi Gras Casino & Resort,https://lh5.googleusercontent.com/p/AF1QipNIVw4rn6ejJX7eFlETQjksHdRePKF4U0qdWai6=w150-h150-k-no-p,hotel
