text,reviewId,url,placeId,categoryName,stars,title,reviewImageUrls/0,genre
"Had an amazing time, lots of fun fish to see!!",ChdDSUhNMG9nS0VJQ0FnSUR3MU9QSWdBRRAB,"https://www.google.com/maps/place/SEA+LIFE+Michigan+Aquarium/@42.7036708,-83.4407003,12z/data=!4m6!3m5!1s0x882495b22d0ac751:0xe518db4be74a1e42!8m2!3d42.7036708!4d-83.2965047!16s%2Fg%2F11c3khpvgx?hl=en",ChIJUccKLbKVJIgRQh5K50vbGOU,Aquarium,5.0,SEA LIFE Michigan Aquarium,https://lh5.googleusercontent.com/p/AF1QipPv8FbwM7BdlFjS3qxdGtwHfuLKmImLC2F1QrbM=w150-h150-k-no-p,activity
"Great Karting track, Fast Karts, and Friendly Staff. Definitely a go-to place outside of Salt Lake City.",ChdDSUhNMG9nS0VJQ0FnSUNDaW96TXNnRRAB,"https://www.google.com/maps/place/Go+Kart+Center+at+Utah+Motorsports+Campus/@40.5805847,-149.2932129,4z/data=!4m6!3m5!1s0x8752b96f2cb8705b:0x82d6a5e85c5b593c!8m2!3d40.5809235!4d-112.3791533!16s%2Fg%2F11f6x_mmwy?hl=en",ChIJW3C4LG-5UocRPFlbXOil1oI,Go-kart track,5.0,Go Kart Center at Utah Motorsports Campus,https://lh5.googleusercontent.com/p/AF1QipNHhIrKDVdOhtG0VC18sxnK7rfA6pLXNsL8U76D=w150-h150-k-no-p,activity
Very friendly staff and chill environment. Love ya all. Thank you,ChZDSUhNMG9nS0VJQ0FnSUQ2MW9PWlJ3EAE,"https://www.google.com/maps/place/Go+Kart+Center+at+Utah+Motorsports+Campus/@40.5805847,-149.2932129,4z/data=!4m6!3m5!1s0x8752b96f2cb8705b:0x82d6a5e85c5b593c!8m2!3d40.5809235!4d-112.3791533!16s%2Fg%2F11f6x_mmwy?hl=en",ChIJW3C4LG-5UocRPFlbXOil1oI,Go-kart track,5.0,Go Kart Center at Utah Motorsports Campus,https://lh5.googleusercontent.com/p/AF1QipOUcqekWosCH3q_NbbPHikOy8FIAD5DNkyyvQks=w150-h150-k-no-p,activity
Last Wednesday dinner at Nicola’s. A taste of Heaven with scallops Zafferano appetizer and melt-in-your-mouth veal Osso buco…to die for! Makes wanna be Carly Simon and sing “Nobody does it better…🎶”,ChZDSUhNMG9nS0VJQ0FnSUNHalBydWNBEAE,"https://www.google.com/maps/place/Nicola+Restaurant+%26+Bar/@40.0536182,-83.0666717,0z/data=!4m6!3m5!1s0x88388d9b0242175f:0x5d0166d550fbecd7!8m2!3d40.0528589!4d-83.0663475!16s%2Fg%2F12hsfc1b7?hl=en",ChIJXxdCApuNOIgR1-z7UNVmAV0,Italian restaurant,5.0,Nicola Restaurant & Bar,https://lh5.googleusercontent.com/p/AF1QipNGkjCsezUhb1gIaSqOR2qO3YfqSC2R-t5qoD_0=w150-h150-k-no-p,restaurant
"Excellent experience! Excellent food prepared by Chef ! Host was excited to welcome us, Beth our waitstaff was excellent!",ChdDSUhNMG9nS0VJQ0FnSUNhby1PTC1nRRAB,"https://www.google.com/maps/place/Nicola+Restaurant+%26+Bar/@40.0536182,-83.0666717,0z/data=!4m6!3m5!1s0x88388d9b0242175f:0x5d0166d550fbecd7!8m2!3d40.0528589!4d-83.0663475!16s%2Fg%2F12hsfc1b7?hl=en",ChIJXxdCApuNOIgR1-z7UNVmAV0,Italian restaurant,5.0,Nicola Restaurant & Bar,https://lh5.googleusercontent.com/p/AF1QipNjwDWqXFjrb9k9cvyWJWcUc1m74mf1He59K5vh=w150-h150-k-no-p,restaurant
"Cute restaurant! We got our own little corner behind curtain, it was quite perfect for a group of loud kids and adults.

Meatballs and the sauces were very good!!! The other entrees portions are all too big. Seafood risotto was not bad, I would prefer the seafood not cooked so much that they were a bit chewy.

We all laughed over the one giant piece of ravioli, that was not expected. It smelled really good and was told that it tasted very good too.

They have a large menu of wine by glass and by bottle. Cocktail menu was pretty standard.

I would prefer here than any other chain restaurant, but there are also much better Italian out there.",ChdDSUhNMG9nS0VJQ0FnSUNndWV5aXN3RRAB,"https://www.google.com/maps/place/Nicola+Restaurant+%26+Bar/@40.0536182,-83.0666717,0z/data=!4m6!3m5!1s0x88388d9b0242175f:0x5d0166d550fbecd7!8m2!3d40.0528589!4d-83.0663475!16s%2Fg%2F12hsfc1b7?hl=en",ChIJXxdCApuNOIgR1-z7UNVmAV0,Italian restaurant,3.0,Nicola Restaurant & Bar,https://lh5.googleusercontent.com/p/AF1QipNHzpLLVZoaUfY0hKZxDNl0pLc0ktdE2v0ekSyz=w150-h150-k-no-p,restaurant
"Wonderful food, beautiful garden setting,  knowledgeable staff.   Chef Nicola and wife Esperanza greet you. The patio makes you think you're in Italy. The homemade creamy limoncello is a must and you have to save room for the limoncello cake!!
Can't reccomend it enough.",ChZDSUhNMG9nS0VJQ0FnSURVdnJ1Q1pnEAE,"https://www.google.com/maps/place/Nicola+Restaurant+%26+Bar/@40.0536182,-83.0666717,0z/data=!4m6!3m5!1s0x88388d9b0242175f:0x5d0166d550fbecd7!8m2!3d40.0528589!4d-83.0663475!16s%2Fg%2F12hsfc1b7?hl=en",ChIJXxdCApuNOIgR1-z7UNVmAV0,Italian restaurant,5.0,Nicola Restaurant & Bar,https://lh5.googleusercontent.com/p/AF1QipNl5c-3z3Bv3L5zFJdLZBAbZ8-0LbWQXStjt6ER=w150-h150-k-no-p,restaurant
"Honestly, this restaurant is incredible.  The food is amazing, the staff pleasantly is at your beck and call. What else can I say other than book a reservation at Nicola as soon as possible.",ChdDSUhNMG9nS0VJQ0FnSUN5N3FqNV9nRRAB,"https://www.google.com/maps/place/Nicola+Restaurant+%26+Bar/@40.0536182,-83.0666717,0z/data=!4m6!3m5!1s0x88388d9b0242175f:0x5d0166d550fbecd7!8m2!3d40.0528589!4d-83.0663475!16s%2Fg%2F12hsfc1b7?hl=en",ChIJXxdCApuNOIgR1-z7UNVmAV0,Italian restaurant,5.0,Nicola Restaurant & Bar,https://lh5.googleusercontent.com/p/AF1QipMmyMYvAH5xlQ7am0hOvlT4siFsvjZXPvU_9vmU=w150-h150-k-no-p,restaurant
Absolutely wonderful experience. We celebrated our 18th wedding anniversary here and everything was wonderful. The service was A+ and the food was delicious. The staff was completely warm and inviting and made us feel right at home. Highly recommend!!! We will definitely be back!!,ChZDSUhNMG9nS0VJQ0FnSUMtdXRyZk5REAE,"https://www.google.com/maps/place/Nicola+Restaurant+%26+Bar/@40.0536182,-83.0666717,0z/data=!4m6!3m5!1s0x88388d9b0242175f:0x5d0166d550fbecd7!8m2!3d40.0528589!4d-83.0663475!16s%2Fg%2F12hsfc1b7?hl=en",ChIJXxdCApuNOIgR1-z7UNVmAV0,Italian restaurant,5.0,Nicola Restaurant & Bar,https://lh5.googleusercontent.com/p/AF1QipN2Iu6Ywje6Jxv7LiVfqqTvJft5h_Lmd6yNOeZQ=w150-h150-k-no-p,restaurant
Wonderful food and atmosphere.  One of our favorite spots for fine Italian food,ChZDSUhNMG9nS0VJQ0FnSUNvcFlxRVJnEAE,"https://www.google.com/maps/place/Nicola+Restaurant+%26+Bar/@40.0536182,-83.0666717,0z/data=!4m6!3m5!1s0x88388d9b0242175f:0x5d0166d550fbecd7!8m2!3d40.0528589!4d-83.0663475!16s%2Fg%2F12hsfc1b7?hl=en",ChIJXxdCApuNOIgR1-z7UNVmAV0,Italian restaurant,5.0,Nicola Restaurant & Bar,https://lh5.googleusercontent.com/p/AF1QipO8lj8yHCd_mrg4Mqbpt6UWXPDthHfF-c5PPNCd=w150-h150-k-no-p,restaurant
"This was our anniversary and we wanted to celebrate with fine tasting Italian food. This was it! Outside on their patio, sipping a tasty, tart cocktail and a nice Barbera red. We love caprese and adding basil pesto is a keeper. The Tuscan Nido was perfect-handmade and hands down the largest ravioli-the added surprise of an egg yolk hidden inside was genius! The Filetto Di Maiale(pork tenderloin) was perfectly cooked and the flavor was mouth watering, even as I ate it! We wrapped it up with their lemon cake. Oh, man, so light and lemony. We took smaller and smaller bites so it would last longer. Give them a go, we’ll certainly be back!",ChZDSUhNMG9nS0VJQ0FnSUN1X3RTVFZnEAE,"https://www.google.com/maps/place/Nicola+Restaurant+%26+Bar/@40.0536182,-83.0666717,0z/data=!4m6!3m5!1s0x88388d9b0242175f:0x5d0166d550fbecd7!8m2!3d40.0528589!4d-83.0663475!16s%2Fg%2F12hsfc1b7?hl=en",ChIJXxdCApuNOIgR1-z7UNVmAV0,Italian restaurant,5.0,Nicola Restaurant & Bar,https://lh5.googleusercontent.com/p/AF1QipN9WTq3S-Fb06UgY-WsxBD4jer8zVXvM8ImePfv=w150-h150-k-no-p,restaurant
I was in Columbus for 4 weeks for work and of course I find this restaurant on my last night in town!  If I would’ve known about this place my first week I would’ve eaten here once a week. Service was good. I got the chicken Marsala and substituted Alfredo sauce with pasta instead of the spaghetti and sauce. It was so good along with the bread and oil!  I want to go back here if I ever get back to Columbus!,ChZDSUhNMG9nS0VJQ0FnSUQwMnVfM2FREAE,"https://www.google.com/maps/place/Nicola+Restaurant+%26+Bar/@40.0536182,-83.0666717,0z/data=!4m6!3m5!1s0x88388d9b0242175f:0x5d0166d550fbecd7!8m2!3d40.0528589!4d-83.0663475!16s%2Fg%2F12hsfc1b7?hl=en",ChIJXxdCApuNOIgR1-z7UNVmAV0,Italian restaurant,5.0,Nicola Restaurant & Bar,https://lh5.googleusercontent.com/p/AF1QipOgKJsk-p1LFgo0gFVpAm_izETd23t2CRbmrXP9=w150-h150-k-no-p,restaurant
"I WAS ROBBED!  The fact that this place is so highly rated is further evidence that Columbus completely lax any decent Italian restaurant.

It was as though some artificial intelligence program was assigned the task to create Italian food.

I would have been more satisfied if I ate a pop tart and gave the rest of my money away.   I could go into detail but it would discriminate some of the many bad aspects of this place

BOO. YUCK. BLAH.",ChdDSUhNMG9nS0VJQ0FnSUNoNVpMRzhnRRAB,"https://www.google.com/maps/place/Nicola+Restaurant+%26+Bar/@40.0536182,-83.0666717,0z/data=!4m6!3m5!1s0x88388d9b0242175f:0x5d0166d550fbecd7!8m2!3d40.0528589!4d-83.0663475!16s%2Fg%2F12hsfc1b7?hl=en",ChIJXxdCApuNOIgR1-z7UNVmAV0,Italian restaurant,1.0,Nicola Restaurant & Bar,https://lh5.googleusercontent.com/p/AF1QipMlWQOKHwSsRdAktNKPv9BgPfIwmebzpJ8hk00r=w150-h150-k-no-p,restaurant
"Worst place to have dinner with family, jugs all broken, bad costumer service. Couple years ago was an awesome place but now it's not worth it to bring your family here for dinner.",ChdDSUhNMG9nS0VJQ0FnSURxMW9XNjRBRRAB,"https://www.google.com/maps/place/Golden+Corral+Buffet+%26+Grill/@42.6257867,-82.9725868,12z/data=!4m6!3m5!1s0x8824de6a6f635361:0x29bec836a11928ca!8m2!3d42.6256103!4d-82.972535!16s%2Fg%2F1x5fb_27?hl=en",ChIJYVNjb2reJIgRyigZoTbIvik,Buffet restaurant,1.0,Golden Corral Buffet & Grill,https://lh5.googleusercontent.com/p/AF1QipMM93C-wwbGKnAT202Mlk8iFBJwULfnNXrG5Xrf=w150-h150-k-no-p,restaurant
Love the quality of the food !!!,ChdDSUhNMG9nS0VJQ0FnSUNBdXBhNDN3RRAB,"https://www.google.com/maps/place/Golden+Corral+Buffet+%26+Grill/@42.6257867,-82.9725868,12z/data=!4m6!3m5!1s0x8824de6a6f635361:0x29bec836a11928ca!8m2!3d42.6256103!4d-82.972535!16s%2Fg%2F1x5fb_27?hl=en",ChIJYVNjb2reJIgRyigZoTbIvik,Buffet restaurant,5.0,Golden Corral Buffet & Grill,https://lh5.googleusercontent.com/p/AF1QipPFJNY-AV_5z2TCSAQPyKTIzSdP8fTDQUBv0y8I=w150-h150-k-no-p,restaurant
I love this restaurant. The food is always delicious. Plus my daughter enjoyed her first birthday there.,ChdDSUhNMG9nS0VJQ0FnSUNnd19HaWh3RRAB,"https://www.google.com/maps/place/Golden+Corral+Buffet+%26+Grill/@42.6257867,-82.9725868,12z/data=!4m6!3m5!1s0x8824de6a6f635361:0x29bec836a11928ca!8m2!3d42.6256103!4d-82.972535!16s%2Fg%2F1x5fb_27?hl=en",ChIJYVNjb2reJIgRyigZoTbIvik,Buffet restaurant,5.0,Golden Corral Buffet & Grill,https://lh5.googleusercontent.com/p/AF1QipOSKDJsQZGyWl6XnrQY9l4sSh_08qc9NoiL7xta=w150-h150-k-no-p,restaurant
The food wasn't too good. Not a lot great choices as far as food or dessert. The kids weren't too fond of the food either. The waitress also didn't refill our drinks in a timely fashion.,ChZDSUhNMG9nS0VJQ0FnSUMtNHBIbktnEAE,"https://www.google.com/maps/place/Golden+Corral+Buffet+%26+Grill/@42.6257867,-82.9725868,12z/data=!4m6!3m5!1s0x8824de6a6f635361:0x29bec836a11928ca!8m2!3d42.6256103!4d-82.972535!16s%2Fg%2F1x5fb_27?hl=en",ChIJYVNjb2reJIgRyigZoTbIvik,Buffet restaurant,1.0,Golden Corral Buffet & Grill,https://lh5.googleusercontent.com/p/AF1QipNlRoldBGzn81PSYQdLzws8eZFxJCBM_LPxMG4j=w150-h150-k-no-p,restaurant
"Decent food for the price. I mean, where else can you go for tamales, steak cooked to order, a fondue fountain, and cotton candy in one restaurant? Go on a weeknight and avoid the weekend at all costs. Even a snowstorm couldn't keep this place from getting PACKED! When it gets like that, there's just not enough staff to compensate. Outside of the weekends it's a good place to go.",ChdDSUhNMG9nS0VJQ0FnSUNvdXBiVV9BRRAB,"https://www.google.com/maps/place/Golden+Corral+Buffet+%26+Grill/@42.6257867,-82.9725868,12z/data=!4m6!3m5!1s0x8824de6a6f635361:0x29bec836a11928ca!8m2!3d42.6256103!4d-82.972535!16s%2Fg%2F1x5fb_27?hl=en",ChIJYVNjb2reJIgRyigZoTbIvik,Buffet restaurant,4.0,Golden Corral Buffet & Grill,https://lh5.googleusercontent.com/p/AF1QipOtXDwz8QWycYVKBIaMygerYpnHzsY641M4snAO=w150-h150-k-no-p,restaurant
The food was hot and Fresh,ChdDSUhNMG9nS0VJQ0FnSUMwd183STRRRRAB,"https://www.google.com/maps/place/Golden+Corral+Buffet+%26+Grill/@42.6257867,-82.9725868,12z/data=!4m6!3m5!1s0x8824de6a6f635361:0x29bec836a11928ca!8m2!3d42.6256103!4d-82.972535!16s%2Fg%2F1x5fb_27?hl=en",ChIJYVNjb2reJIgRyigZoTbIvik,Buffet restaurant,5.0,Golden Corral Buffet & Grill,https://lh5.googleusercontent.com/p/AF1QipNZMe3E0pbY-UZ3aCmOz6A0CSsLtY3tAeSiBZks=w150-h150-k-no-p,restaurant
"Lots of variety depending on your dietary needs or wants. Soul and comfort food. I can eat lower carb meals here with salad, veggies, and meats. Plenty of dessert options and a large salad bar.",ChZDSUhNMG9nS0VJQ0FnSUNzZzhTSGVBEAE,"https://www.google.com/maps/place/Golden+Corral+Buffet+%26+Grill/@42.6257867,-82.9725868,12z/data=!4m6!3m5!1s0x8824de6a6f635361:0x29bec836a11928ca!8m2!3d42.6256103!4d-82.972535!16s%2Fg%2F1x5fb_27?hl=en",ChIJYVNjb2reJIgRyigZoTbIvik,Buffet restaurant,5.0,Golden Corral Buffet & Grill,https://lh5.googleusercontent.com/p/AF1QipOp3K6bY1Cn0ryFTCBZgJHin0UeQcyLWWDEBMQL=w150-h150-k-no-p,restaurant
It hit the spot!,ChZDSUhNMG9nS0VJQ0FnSURNNFBLeFV3EAE,"https://www.google.com/maps/place/Golden+Corral+Buffet+%26+Grill/@42.6257867,-82.9725868,12z/data=!4m6!3m5!1s0x8824de6a6f635361:0x29bec836a11928ca!8m2!3d42.6256103!4d-82.972535!16s%2Fg%2F1x5fb_27?hl=en",ChIJYVNjb2reJIgRyigZoTbIvik,Buffet restaurant,4.0,Golden Corral Buffet & Grill,https://lh5.googleusercontent.com/p/AF1QipPIM5qjUwT6UHWjv-_Q8avOlPyMoojsxgPWUwWM=w150-h150-k-no-p,restaurant
"Jon was very good about getting to know each of the tables he served, all while keeping up on drinks for everyone in the area.

Great food, 2 plates and still gotta try alot more..oof I'm full",ChZDSUhNMG9nS0VJQ0FnSURnNEtIblB3EAE,"https://www.google.com/maps/place/Golden+Corral+Buffet+%26+Grill/@42.6257867,-82.9725868,12z/data=!4m6!3m5!1s0x8824de6a6f635361:0x29bec836a11928ca!8m2!3d42.6256103!4d-82.972535!16s%2Fg%2F1x5fb_27?hl=en",ChIJYVNjb2reJIgRyigZoTbIvik,Buffet restaurant,5.0,Golden Corral Buffet & Grill,https://lh5.googleusercontent.com/p/AF1QipPxWnofbDYNboesW_R_xguMbQbNw8tFytr87zU5=w150-h150-k-no-p,restaurant
"Nasty, dirty, gross. Silverware 99% dirty, out of everything. Asked our server if food was going to be put out she said ""ya when it's empty they bring out more"". I got a roll broke in half and it had a string or something in the middle baked into it.",ChZDSUhNMG9nS0VJQ0FnSURXbzYzZUxBEAE,"https://www.google.com/maps/place/Golden+Corral+Buffet+%26+Grill/@42.6257867,-82.9725868,12z/data=!4m6!3m5!1s0x8824de6a6f635361:0x29bec836a11928ca!8m2!3d42.6256103!4d-82.972535!16s%2Fg%2F1x5fb_27?hl=en",ChIJYVNjb2reJIgRyigZoTbIvik,Buffet restaurant,1.0,Golden Corral Buffet & Grill,https://lh5.googleusercontent.com/p/AF1QipNl0Gh1_71EVlJyJxuDojsTDicIjX6b4Qi3QmT1=w150-h150-k-no-p,restaurant
"Took our 6 yr old nephew out and had a great time. I of course took it seriously and found the obstacles to be well placed and good equalizers for everyone to have fun. Bonus, ball chargers got the kid excited throughout the course. I’ve already recommended glow putt to other friends with small children.",ChZDSUhNMG9nS0VJQ0FnSUMyNTh1TlJREAE,"https://www.google.com/maps/place/Glow+Putt+Mini+Golf/@33.6993582,-115.3475306,7z/data=!4m6!3m5!1s0x872b753fac1e0b65:0xd04a63150126e39f!8m2!3d33.5836995!4d-111.8837386!16s%2Fg%2F11b5wkmnp1?hl=en",ChIJZQserD91K4cRn-MmARVjStA,Miniature golf course,5.0,Glow Putt Mini Golf,https://lh5.googleusercontent.com/p/AF1QipOnXCQMLUJWP2FZzC9E38uTQBYHERDydFybLIow=w150-h150-k-no-p,activity
Putters are in great condition. Course has vibrant glow-in-the-dark colors and is bright enough to be a good place for family-friendly fun. Helpful staff. Second round is half price. You can win a free game for a hole-in-one on final hole (which I did). My wife and I had a great time and will be repeat customers.,ChdDSUhNMG9nS0VJQ0FnSURVX3BXWHNnRRAB,"https://www.google.com/maps/place/Glow+Putt+Mini+Golf/@33.6993582,-115.3475306,7z/data=!4m6!3m5!1s0x872b753fac1e0b65:0xd04a63150126e39f!8m2!3d33.5836995!4d-111.8837386!16s%2Fg%2F11b5wkmnp1?hl=en",ChIJZQserD91K4cRn-MmARVjStA,Miniature golf course,4.0,Glow Putt Mini Golf,https://lh5.googleusercontent.com/p/AF1QipNcNzhBquLMIrNOf8jvQ-xfytJW_2nfLzlRRHxZ=w150-h150-k-no-p,activity
"Very unique mini golf because of the glow in the dark decor, balls, and clubs. The provided 3D glasses adds to the experience.  For more fun, wear fluorescent or white clothes.",ChZDSUhNMG9nS0VJQ0FnSURxd1p6TURREAE,"https://www.google.com/maps/place/Glow+Putt+Mini+Golf/@33.6993582,-115.3475306,7z/data=!4m6!3m5!1s0x872b753fac1e0b65:0xd04a63150126e39f!8m2!3d33.5836995!4d-111.8837386!16s%2Fg%2F11b5wkmnp1?hl=en",ChIJZQserD91K4cRn-MmARVjStA,Miniature golf course,5.0,Glow Putt Mini Golf,https://lh5.googleusercontent.com/p/AF1QipNZxVgnv0lJ9Oww24ePO3lTQOy-H8jVE1Wug3Mv=w150-h150-k-no-p,activity
"Very fun little mini golf. Very clean, the neon lighting and glow is cool and the holes and greens in good condition. Happened to do one video and it was a hole in one... was there with 3 generations (20 year old, 46 year old and two 75 year olds)Olds. We all enjoyed.",ChdDSUhNMG9nS0VJQ0FnSURCOUphUHZ3RRAB,"https://www.google.com/maps/place/Glow+Putt+Mini+Golf/@33.6993582,-115.3475306,7z/data=!4m6!3m5!1s0x872b753fac1e0b65:0xd04a63150126e39f!8m2!3d33.5836995!4d-111.8837386!16s%2Fg%2F11b5wkmnp1?hl=en",ChIJZQserD91K4cRn-MmARVjStA,Miniature golf course,5.0,Glow Putt Mini Golf,https://lh5.googleusercontent.com/p/AF1QipMrpowuWy0AEgXspdKU7otyzhBCwh19B3JK3nm-=w150-h150-k-no-p,activity
Such a cute mini golf place! Great service from the friendly owner. We went as a group of two adults and had a blast—not just for kids! Very fun photo ops.,ChZDSUhNMG9nS0VJQ0FnSURCcXREeE13EAE,"https://www.google.com/maps/place/Glow+Putt+Mini+Golf/@33.6993582,-115.3475306,7z/data=!4m6!3m5!1s0x872b753fac1e0b65:0xd04a63150126e39f!8m2!3d33.5836995!4d-111.8837386!16s%2Fg%2F11b5wkmnp1?hl=en",ChIJZQserD91K4cRn-MmARVjStA,Miniature golf course,5.0,Glow Putt Mini Golf,https://lh5.googleusercontent.com/p/AF1QipPDLB_EjVwIvE-GAT6p9NrRdtcj4Rc2OeadXA-t=w150-h150-k-no-p,activity
Oh my gosh! I can’t say enough good about this place. Price is great! Great family fun! Creative and unique! We absolutely loved this place! My kids already want to go back!,ChZDSUhNMG9nS0VJQ0FnSUNHaWFIMlJBEAE,"https://www.google.com/maps/place/Glow+Putt+Mini+Golf/@33.6993582,-115.3475306,7z/data=!4m6!3m5!1s0x872b753fac1e0b65:0xd04a63150126e39f!8m2!3d33.5836995!4d-111.8837386!16s%2Fg%2F11b5wkmnp1?hl=en",ChIJZQserD91K4cRn-MmARVjStA,Miniature golf course,5.0,Glow Putt Mini Golf,https://lh5.googleusercontent.com/p/AF1QipOOJCpRBjj_dmlMm_H3MnnMRn5YyYdt3uJR3CR-=w150-h150-k-no-p,activity
"So fun!  Very nice course, friendly staff.",ChZDSUhNMG9nS0VJQ0FnSUNhb3N5YWF3EAE,"https://www.google.com/maps/place/Glow+Putt+Mini+Golf/@33.6993582,-115.3475306,7z/data=!4m6!3m5!1s0x872b753fac1e0b65:0xd04a63150126e39f!8m2!3d33.5836995!4d-111.8837386!16s%2Fg%2F11b5wkmnp1?hl=en",ChIJZQserD91K4cRn-MmARVjStA,Miniature golf course,5.0,Glow Putt Mini Golf,https://lh5.googleusercontent.com/p/AF1QipOdVAoPdwbTMul5A-G71eSLisTb-XTFaf2x1WoA=w150-h150-k-no-p,activity
Very fun and family friendly everything was amazing. Very clean and sanitized. First time an we all loved it.,ChZDSUhNMG9nS0VJQ0FnSURXc3FDeklnEAE,"https://www.google.com/maps/place/Glow+Putt+Mini+Golf/@33.6993582,-115.3475306,7z/data=!4m6!3m5!1s0x872b753fac1e0b65:0xd04a63150126e39f!8m2!3d33.5836995!4d-111.8837386!16s%2Fg%2F11b5wkmnp1?hl=en",ChIJZQserD91K4cRn-MmARVjStA,Miniature golf course,5.0,Glow Putt Mini Golf,https://lh5.googleusercontent.com/p/AF1QipNCTH075OQYDVfGe57_YQ_Rm6isTofLbIPoc10S=w150-h150-k-no-p,activity
"If you like mini golf this is the place to play out of the heat! Lots of glow in the dark color, moving colorful floor designs, silk trees and plenty of action for couples and families. We went at 10:00 am and it wasn't busy. By the time we left at 11:15 am, more and more people were coming in to test their skills and have fun. We had a great time and even won a free golf game on the last hole!",ChZDSUhNMG9nS0VJQ0FnSURPcC1DX0pBEAE,"https://www.google.com/maps/place/Glow+Putt+Mini+Golf/@33.6993582,-115.3475306,7z/data=!4m6!3m5!1s0x872b753fac1e0b65:0xd04a63150126e39f!8m2!3d33.5836995!4d-111.8837386!16s%2Fg%2F11b5wkmnp1?hl=en",ChIJZQserD91K4cRn-MmARVjStA,Miniature golf course,5.0,Glow Putt Mini Golf,https://lh5.googleusercontent.com/p/AF1QipPQ_jY9hSsbis0fXJUTsMp0xpt7tf_U0mSqtP0A=w150-h150-k-no-p,activity
"A very fun escape. It's probably best suited for kids, but I had a blast as an adult! I felt like a kid again.",ChZDSUhNMG9nS0VJQ0FnSUNLdHBIRE53EAE,"https://www.google.com/maps/place/Glow+Putt+Mini+Golf/@33.6993582,-115.3475306,7z/data=!4m6!3m5!1s0x872b753fac1e0b65:0xd04a63150126e39f!8m2!3d33.5836995!4d-111.8837386!16s%2Fg%2F11b5wkmnp1?hl=en",ChIJZQserD91K4cRn-MmARVjStA,Miniature golf course,5.0,Glow Putt Mini Golf,https://lh5.googleusercontent.com/p/AF1QipPF9w4eTd3Z4jhedpip46EE8VKiGn5eFp3oMHl7=w150-h150-k-no-p,activity
"Best quality French fries! Yummy yummy!
Shrimp! Mmmmmmmm",ChZDSUhNMG9nS0VJQ0FnSUNraTZxdUZ3EAE,"https://www.google.com/maps/place/3+Rivers+Resort+%26+Guide+Service/@45.7036614,-127.7180914,6z/data=!4m9!3m8!1s0x548e7e59abe9c5ff:0x9108a6eada4a7cef!5m2!4m1!1i2!8m2!3d47.9131228!4d-124.534736!16s%2Fg%2F1th631y4?hl=en",ChIJ_8Xpq1l-jlQR73xK2uqmCJE,Resort hotel,5.0,3 Rivers Resort & Guide Service,https://lh5.googleusercontent.com/p/AF1QipPD9GXKdOekKy5uVWttDGkMye5WIDSMwXtN-gy1=w150-h150-k-no-p,hotel
"An awesome campground! Their burgers were delicious, and the store was quaint and helpful. Really exotic feel among the mossy tall trees and mysterious fog. We really enjoyed eating our burgers around a fire and watching a movie on our smart phone at our campsite. Would love to return some day! They also have some cute little Twilight references throughout their campground!",ChdDSUhNMG9nS0VJQ0FnSUNDdjhfQWhRRRAB,"https://www.google.com/maps/place/3+Rivers+Resort+%26+Guide+Service/@45.7036614,-127.7180914,6z/data=!4m9!3m8!1s0x548e7e59abe9c5ff:0x9108a6eada4a7cef!5m2!4m1!1i2!8m2!3d47.9131228!4d-124.534736!16s%2Fg%2F1th631y4?hl=en",ChIJ_8Xpq1l-jlQR73xK2uqmCJE,Resort hotel,5.0,3 Rivers Resort & Guide Service,https://lh5.googleusercontent.com/p/AF1QipNiQQa8VOnHx6crSfp0hNzc5OaV2b2yG3qSF6Cm=w150-h150-k-no-p,hotel
"Resort and campground.  Importantly, it has showers for campers.  There is also a grocery store on site.  Importantly, the showers are UNAVAILABLE to guests outside the resort. Also here is the ""famous"" Twilight plaque.",ChZDSUhNMG9nS0VJQ0FnSUN1akx2NlhnEAE,"https://www.google.com/maps/place/3+Rivers+Resort+%26+Guide+Service/@45.7036614,-127.7180914,6z/data=!4m9!3m8!1s0x548e7e59abe9c5ff:0x9108a6eada4a7cef!5m2!4m1!1i2!8m2!3d47.9131228!4d-124.534736!16s%2Fg%2F1th631y4?hl=en",ChIJ_8Xpq1l-jlQR73xK2uqmCJE,Resort hotel,5.0,3 Rivers Resort & Guide Service,https://lh5.googleusercontent.com/p/AF1QipMT3V3zg6x0FsgRnrMO0Id2phUmjw0PjzqZwkMM=w150-h150-k-no-p,hotel
"This place was a recommendation and man are we glad we listened! It's a little hole in wall joint. Has a pretty good size menu. You order at the front and can take a seat and wait. They have a Twilight themed menu for those visiting for fun(; I had the Bella Bananas Split and it was amazing. I'm a vegetarian and had a few options which was nice. I had a salad and my husband and kids had burgers. There was hardly any crumbs left. The onion rings were AMAZING. Beer battered and fried to perfection. There is four of us and we each got a meal with sides and everyone got a dessert for $50 bucks the prices were very fair. The workers were all so nice and friendly. We will be coming back for sure!!!!!!

If visiting for Twilight they also have a Treaty Line sign across the street and a few different tourist items to check out!!!! Stop on your way to La Push and grab some burgers to eat at the beach!",ChZDSUhNMG9nS0VJQ0FnSURJaHVESUx3EAE,"https://www.google.com/maps/place/3+Rivers+Resort+%26+Guide+Service/@45.7036614,-127.7180914,6z/data=!4m9!3m8!1s0x548e7e59abe9c5ff:0x9108a6eada4a7cef!5m2!4m1!1i2!8m2!3d47.9131228!4d-124.534736!16s%2Fg%2F1th631y4?hl=en",ChIJ_8Xpq1l-jlQR73xK2uqmCJE,Resort hotel,5.0,3 Rivers Resort & Guide Service,https://lh5.googleusercontent.com/p/AF1QipMH6F7wND2YGwJ19AfazJNhTL44m4AkzBl-luNA=w150-h150-k-no-p,hotel
"Very friendly staff, cabins were adorable, well heated, clean, and had everything you need. Not to mention literally on the treaty line 🦇",ChZDSUhNMG9nS0VJQ0FnSUN5NTZfLWRREAE,"https://www.google.com/maps/place/3+Rivers+Resort+%26+Guide+Service/@45.7036614,-127.7180914,6z/data=!4m9!3m8!1s0x548e7e59abe9c5ff:0x9108a6eada4a7cef!5m2!4m1!1i2!8m2!3d47.9131228!4d-124.534736!16s%2Fg%2F1th631y4?hl=en",ChIJ_8Xpq1l-jlQR73xK2uqmCJE,Resort hotel,5.0,3 Rivers Resort & Guide Service,https://lh5.googleusercontent.com/p/AF1QipMRRZwj-_88Coo_oVca9QEWBWTzZVXMDPXIA7I8=w150-h150-k-no-p,hotel
"Cute, and very clean little cabin. The beds were super comfortable. It had complimentary coffee/hot cocoa. Friendly staff. There is a restaurant, and small store within a 1-2 minute walk. The restaurant had a ""Twilight"" theme, which was kind of fun. The Vampire threat level was high when we visited",ChZDSUhNMG9nS0VJQ0FnSUMwaHNyb0NnEAE,"https://www.google.com/maps/place/3+Rivers+Resort+%26+Guide+Service/@45.7036614,-127.7180914,6z/data=!4m9!3m8!1s0x548e7e59abe9c5ff:0x9108a6eada4a7cef!5m2!4m1!1i2!8m2!3d47.9131228!4d-124.534736!16s%2Fg%2F1th631y4?hl=en",ChIJ_8Xpq1l-jlQR73xK2uqmCJE,Resort hotel,5.0,3 Rivers Resort & Guide Service,https://lh5.googleusercontent.com/p/AF1QipPyqKEn0w5FZT4tq_sNaf5leCnTP4qk3LfFWQPk=w150-h150-k-no-p,hotel
