text,reviewId,url,placeId,categoryName,stars,title,reviewImageUrls/0,genre
"The hotel was ok, and the room appeared clean.  The TV worked and the AC worked too.

The lady at the front desk was very nice and apologetic about our not being ready at 2:15.

The bed was worst bed I have slept on in years, but the wort part was the bug my wife found in our bed in the morning.",ChdDSUhNMG9nS0VJQ0FnSURPcEpENzRnRRAB,"https://www.google.com/maps/place/Super+8+by+Wyndham+Shelton/@46.9313928,-124.1293552,9z/data=!4m9!3m8!1s0x54919635352bb289:0xaee22d72202ca598!5m2!4m1!1i2!8m2!3d47.2285512!4d-123.1270808!16s%2Fg%2F1th56pvs?hl=en",ChIJibIrNTWWkVQRmKUsIHIt4q4,Hotel,3.0,Super 8 by Wyndham Shelton,https://lh5.googleusercontent.com/p/AF1QipP6GLuUwZZpPIFLPRcM5fCFnsyoBVZI3AR_1zYi=w150-h150-k-no-p,hotel
Feel like a kid again. So many things to do n private parties enclosed. Pizza was delicious n filling.,ChdDSUhNMG9nS0VJQ0FnSUQ2MS1TejBBRRAB,"https://www.google.com/maps/place/Funz+Trampoline+Park+Hamden/@42.3451954,-74.8547337,8z/data=!4m6!3m5!1s0x89e7dbaf60ca5e8d:0x977e213c3609a5c8!8m2!3d41.3472084!4d-72.9314499!16s%2Fg%2F11fsm3rkfv?hl=en",ChIJjV7KYK_b54kRyKUJNjwhfpc,Amusement park,5.0,Funz Trampoline Park Hamden,https://lh5.googleusercontent.com/p/AF1QipPOphR3IbtwQoZ5o8qZo1-TGT-bBYYNI0EyqvHi=w150-h150-k-no-p,activity
Overpriced and small. I don’t find it worth it and they also have less trampolines.,ChZDSUhNMG9nS0VJQ0FnSUNLd1lPakpnEAE,"https://www.google.com/maps/place/Funz+Trampoline+Park+Hamden/@42.3451954,-74.8547337,8z/data=!4m6!3m5!1s0x89e7dbaf60ca5e8d:0x977e213c3609a5c8!8m2!3d41.3472084!4d-72.9314499!16s%2Fg%2F11fsm3rkfv?hl=en",ChIJjV7KYK_b54kRyKUJNjwhfpc,Amusement park,3.0,Funz Trampoline Park Hamden,https://lh5.googleusercontent.com/p/AF1QipOcprSMcY7zFa45iL_gGnbBhSK7sYc_UAxvyWj7=w150-h150-k-no-p,activity
"Perfect for the family.
Was a blast.",ChZDSUhNMG9nS0VJQ0FnSUNTb296VFB3EAE,"https://www.google.com/maps/place/Funz+Trampoline+Park+Hamden/@42.3451954,-74.8547337,8z/data=!4m6!3m5!1s0x89e7dbaf60ca5e8d:0x977e213c3609a5c8!8m2!3d41.3472084!4d-72.9314499!16s%2Fg%2F11fsm3rkfv?hl=en",ChIJjV7KYK_b54kRyKUJNjwhfpc,Amusement park,5.0,Funz Trampoline Park Hamden,https://lh5.googleusercontent.com/p/AF1QipMqLIRbQMujoH674S-qnTHGPVoI7ubvmPJ-Esdd=w150-h150-k-no-p,activity
"Awesome place tor the kids although not as much adult entertainment areas except for some arcades pool table and table hocky, i wanted ro jump with my girls like in fun zone but i wouldve felt awkward as an adult in them kiddie zones....i still give it 4 stars bc it is a kids place mainly and my babies did have an awesome time !!",ChZDSUhNMG9nS0VJQ0FnSURpeGFxQVRnEAE,"https://www.google.com/maps/place/Funz+Trampoline+Park+Hamden/@42.3451954,-74.8547337,8z/data=!4m6!3m5!1s0x89e7dbaf60ca5e8d:0x977e213c3609a5c8!8m2!3d41.3472084!4d-72.9314499!16s%2Fg%2F11fsm3rkfv?hl=en",ChIJjV7KYK_b54kRyKUJNjwhfpc,Amusement park,4.0,Funz Trampoline Park Hamden,https://lh5.googleusercontent.com/p/AF1QipNLnnM4qCIifLQ898vTlpx28PMuoFCaHj2ikuth=w150-h150-k-no-p,activity
"Visited a few times now,  manager is always there and always helpful!! Place is clean!! Well staffed and all staff are friendly and responsive to anything! I couldn't imagine working with kids in this environment they make it look easy! Thank you too the staff !",ChdDSUhNMG9nS0VJQ0FnSUNxMDdlSHlRRRAB,"https://www.google.com/maps/place/Funz+Trampoline+Park+Hamden/@42.3451954,-74.8547337,8z/data=!4m6!3m5!1s0x89e7dbaf60ca5e8d:0x977e213c3609a5c8!8m2!3d41.3472084!4d-72.9314499!16s%2Fg%2F11fsm3rkfv?hl=en",ChIJjV7KYK_b54kRyKUJNjwhfpc,Amusement park,5.0,Funz Trampoline Park Hamden,https://lh5.googleusercontent.com/p/AF1QipNL5XU1dqG58gcvn8p-pdpB2Pc7cT_C6lSmDU69=w150-h150-k-no-p,activity
The location is very nice and have a lot of space. Which is great for kids in raining day and snowy days.They seemed not to care too much about cleaning. Some of the area are a little old. For example the sponges on the phone attached. Behind that area the is a lot of dirt. There are a lot of broken toys.,ChZDSUhNMG9nS0VJQ0FnSUNSNW83UFF3EAE,"https://www.google.com/maps/place/Funz+Trampoline+Park+Hamden/@42.3451954,-74.8547337,8z/data=!4m6!3m5!1s0x89e7dbaf60ca5e8d:0x977e213c3609a5c8!8m2!3d41.3472084!4d-72.9314499!16s%2Fg%2F11fsm3rkfv?hl=en",ChIJjV7KYK_b54kRyKUJNjwhfpc,Amusement park,2.0,Funz Trampoline Park Hamden,https://lh5.googleusercontent.com/p/AF1QipPqhGlwATrtb2ZsFWU--caIl9RPtKalcdJE3i7G=w150-h150-k-no-p,activity
"Went today for a 5th birthday party. Place is nice,  not in the best area of town though...... But overall this place was pretty nice.  Good layout and plenty of places for kids to play. Due to how many parties there were or was really busy so if you have more than one kid you better bring an extra adult so you can try and divide and conquer 😉.  The kid working said in one day on the weekends they do 20 parties a day...... it was wild.  I'm an adult and I had a great time running wild with my kids lol.",ChZDSUhNMG9nS0VJQ0FnSUMteTdYaUxBEAE,"https://www.google.com/maps/place/Funz+Trampoline+Park+Hamden/@42.3451954,-74.8547337,8z/data=!4m6!3m5!1s0x89e7dbaf60ca5e8d:0x977e213c3609a5c8!8m2!3d41.3472084!4d-72.9314499!16s%2Fg%2F11fsm3rkfv?hl=en",ChIJjV7KYK_b54kRyKUJNjwhfpc,Amusement park,4.0,Funz Trampoline Park Hamden,https://lh5.googleusercontent.com/p/AF1QipNb0wIebdLDQniqtP8-gC1Ug5EGK95neB9qB9EU=w150-h150-k-no-p,activity
"The kids just loved it and enjoy themselves very much so did us Grandmas, yes we joined in 😁🤣!",ChdDSUhNMG9nS0VJQ0FnSURLMEttanRBRRAB,"https://www.google.com/maps/place/Funz+Trampoline+Park+Hamden/@42.3451954,-74.8547337,8z/data=!4m6!3m5!1s0x89e7dbaf60ca5e8d:0x977e213c3609a5c8!8m2!3d41.3472084!4d-72.9314499!16s%2Fg%2F11fsm3rkfv?hl=en",ChIJjV7KYK_b54kRyKUJNjwhfpc,Amusement park,5.0,Funz Trampoline Park Hamden,https://lh5.googleusercontent.com/p/AF1QipMwg0UU-57TY8njGZ0vhsKIRzxTzV5ICD91A3iF=w150-h150-k-no-p,activity
"One of best places to take kids without breaking the bank. Half the price of a lot of other attractions, great staff. Always welcoming and accommodating. Will continue here as a regular customer. Manager is great guy to do business with.",ChZDSUhNMG9nS0VJQ0FnSUN1MFotSElREAE,"https://www.google.com/maps/place/Funz+Trampoline+Park+Hamden/@42.3451954,-74.8547337,8z/data=!4m6!3m5!1s0x89e7dbaf60ca5e8d:0x977e213c3609a5c8!8m2!3d41.3472084!4d-72.9314499!16s%2Fg%2F11fsm3rkfv?hl=en",ChIJjV7KYK_b54kRyKUJNjwhfpc,Amusement park,5.0,Funz Trampoline Park Hamden,https://lh5.googleusercontent.com/p/AF1QipO6HZG1vLvJ-ieoYq5-jOHWtsvpEn_W20z06Oc5=w150-h150-k-no-p,activity
"Very clean,  very safe,  small amount of people allowed at a time,  perfect",ChdDSUhNMG9nS0VJQ0FnSUNLd2Jic3F3RRAB,"https://www.google.com/maps/place/Funz+Trampoline+Park+Hamden/@42.3451954,-74.8547337,8z/data=!4m6!3m5!1s0x89e7dbaf60ca5e8d:0x977e213c3609a5c8!8m2!3d41.3472084!4d-72.9314499!16s%2Fg%2F11fsm3rkfv?hl=en",ChIJjV7KYK_b54kRyKUJNjwhfpc,Amusement park,5.0,Funz Trampoline Park Hamden,https://lh5.googleusercontent.com/p/AF1QipNQzUSBlR_96yoTchhe_E20MaLNO_yI1Q3FI2sX=w150-h150-k-no-p,activity
"If you are looking for a great mini-golf experience then this should be your choice.

It is a fun course, kind of classic (apparently around 35 years old) and aging quite well.

My son is a bit of a mini-golf fanatic and he loves that you can see the ball travel through the ""trough""; the classic touch I suppose... : )",ChdDSUhNMG9nS0VJQ0FnSURvNFp5THNRRRAB,"https://www.google.com/maps/place/Sonoma+Family+Fun+Center/@38.3005492,-127.0908171,7z/data=!4m6!3m5!1s0x8085ac396168548d:0x9efb670ce117de9c!8m2!3d38.3005492!4d-122.4765593!16s%2Fg%2F11hd1yn5b0?hl=en",ChIJjVRoYTmshYARnN4X4Qxn-54,Miniature golf course,5.0,Sonoma Family Fun Center,https://lh5.googleusercontent.com/p/AF1QipPhKC2ikzpRZZ_U3wnMLtGRjy2GWlWqdWqpICca=w150-h150-k-no-p,activity
Very busy zoo and parking was insane but everything was super organized which kept traffic flowing to avoid long wait times in lines. Tons to do! Can’t wait to come back!,ChdDSUhNMG9nS0VJQ0FnSUR5MzRiTHpnRRAB,"https://www.google.com/maps/place/San+Antonio+Zoo/@30.4786865,-105.8819976,6z/data=!4m6!3m5!1s0x865cf59ad8dd658d:0x29d4de62fd5bc2a4!8m2!3d29.4623904!4d-98.4737232!16s%2Fm%2F027j95d?hl=en",ChIJjWXd2Jr1XIYRpMJb_WLe1Ck,Zoo,4.0,San Antonio Zoo,https://lh5.googleusercontent.com/p/AF1QipOhZgQNTd5sngqxb3RVNYadbNPI4e-iaJyL-bJ8=w150-h150-k-no-p,activity
The zoo its good and so big lots of walking. One thing i didnt like are the lines to do for exibits and some prices but worth it,ChdDSUhNMG9nS0VJQ0FnSUNSZ3JEdnlnRRAB,"https://www.google.com/maps/place/San+Antonio+Zoo/@30.4786865,-105.8819976,6z/data=!4m6!3m5!1s0x865cf59ad8dd658d:0x29d4de62fd5bc2a4!8m2!3d29.4623904!4d-98.4737232!16s%2Fm%2F027j95d?hl=en",ChIJjWXd2Jr1XIYRpMJb_WLe1Ck,Zoo,5.0,San Antonio Zoo,https://lh5.googleusercontent.com/p/AF1QipNgcrPQGqEGjcz6M-zPhlhRK2s7L6j8P-OYPhPu=w150-h150-k-no-p,activity
"This zoo isn't as magnificent as a zoo in a big city, and it could certainly use some touch ups and more interaction with technology, but for the price, it's not a bad way to spend time with family.",ChZDSUhNMG9nS0VJQ0FnSUNRMVpqSFJnEAE,"https://www.google.com/maps/place/San+Antonio+Zoo/@30.4786865,-105.8819976,6z/data=!4m6!3m5!1s0x865cf59ad8dd658d:0x29d4de62fd5bc2a4!8m2!3d29.4623904!4d-98.4737232!16s%2Fm%2F027j95d?hl=en",ChIJjWXd2Jr1XIYRpMJb_WLe1Ck,Zoo,4.0,San Antonio Zoo,https://lh5.googleusercontent.com/p/AF1QipPoKUL7yK78xeu1J6yAk87v8Iqlrz0n1RmKL07e=w150-h150-k-no-p,activity
"Super interactive zoo, we love this place!  Feeding the flamingo's was one of the coolest experiences I have ever had!",ChZDSUhNMG9nS0VJQ0FnSUN5eTZDdGRnEAE,"https://www.google.com/maps/place/San+Antonio+Zoo/@30.4786865,-105.8819976,6z/data=!4m6!3m5!1s0x865cf59ad8dd658d:0x29d4de62fd5bc2a4!8m2!3d29.4623904!4d-98.4737232!16s%2Fm%2F027j95d?hl=en",ChIJjWXd2Jr1XIYRpMJb_WLe1Ck,Zoo,5.0,San Antonio Zoo,https://lh5.googleusercontent.com/p/AF1QipMaryewjTBPraFVszHeDXWjMMgCWIa-T-o_gzOs=w150-h150-k-no-p,activity
"Fantastic zoo! I think they have every animal here. It was so many from all over the world, some I never heard of. There are also interactive experiences such as feeding the giraffes and petting kangaroos. You will have to pay for these things, which turned me off a bit since I think the zoo makes money from so many other things. There is also a kiddie amusement park right next to the zoos if parents want to find other ways to amuse their kids. I highly suggest you buy a Groupon or find some other site that would allow you to get a discount. I didn’t and paid the full price of $31.00 and I wasn’t pleased. With that said I still would recommend going here if you are in San Antonio.",ChZDSUhNMG9nS0VJQ0FnSUN1LVpyMGZBEAE,"https://www.google.com/maps/place/San+Antonio+Zoo/@30.4786865,-105.8819976,6z/data=!4m6!3m5!1s0x865cf59ad8dd658d:0x29d4de62fd5bc2a4!8m2!3d29.4623904!4d-98.4737232!16s%2Fm%2F027j95d?hl=en",ChIJjWXd2Jr1XIYRpMJb_WLe1Ck,Zoo,4.0,San Antonio Zoo,https://lh5.googleusercontent.com/p/AF1QipOfIqFi2SyckA890qL3t3kC7YrI9P4GloSIGBAk=w150-h150-k-no-p,activity
"Although a couple major attractions are no longer options there is still much to gain from a trip to The San Antonio Zoo!!

Must see attractions include the Giraffe feeding experience, the up close and personal bird and butterfly exhibits, the wondrous train ride and please don't forget to get a wax figurine made right in front of you to keep as a token of your memorable trip!!",ChdDSUhNMG9nS0VJQ0FnSUMyeHZuRDB3RRAB,"https://www.google.com/maps/place/San+Antonio+Zoo/@30.4786865,-105.8819976,6z/data=!4m6!3m5!1s0x865cf59ad8dd658d:0x29d4de62fd5bc2a4!8m2!3d29.4623904!4d-98.4737232!16s%2Fm%2F027j95d?hl=en",ChIJjWXd2Jr1XIYRpMJb_WLe1Ck,Zoo,4.0,San Antonio Zoo,https://lh5.googleusercontent.com/p/AF1QipPJ_oWLKcBE1NKlHI2JedvkJRCxpRWlH2IFr7hm=w150-h150-k-no-p,activity
"San Antonio zoo was fun,,however alot of the exhibits were closed which made it less entertaining. Then we bought souvenirs and told no plastic bags. Had to either carry our merchandise or buy a bag,,which we found very bad business for the zoo. All about the money",ChdDSUhNMG9nS0VJQ0FnSURNa3NHd2tRRRAB,"https://www.google.com/maps/place/San+Antonio+Zoo/@30.4786865,-105.8819976,6z/data=!4m6!3m5!1s0x865cf59ad8dd658d:0x29d4de62fd5bc2a4!8m2!3d29.4623904!4d-98.4737232!16s%2Fm%2F027j95d?hl=en",ChIJjWXd2Jr1XIYRpMJb_WLe1Ck,Zoo,4.0,San Antonio Zoo,https://lh5.googleusercontent.com/p/AF1QipOcXUSXLT5VuONnD42OZ5Y1mXANQPMMKNV8xC4c=w150-h150-k-no-p,activity
They have a great selection of animals. Fun for the whole family. Not wheel chair accessible in some parts. Alot of parking spots. Parking lot was dirty though. Dirty diapers laying around. I had a great time with my boyfriend!!! I got a souvenir. We spent 3.5 hours there,ChdDSUhNMG9nS0VJQ0FnSUN3c3Z2NTVRRRAB,"https://www.google.com/maps/place/San+Antonio+Zoo/@30.4786865,-105.8819976,6z/data=!4m6!3m5!1s0x865cf59ad8dd658d:0x29d4de62fd5bc2a4!8m2!3d29.4623904!4d-98.4737232!16s%2Fm%2F027j95d?hl=en",ChIJjWXd2Jr1XIYRpMJb_WLe1Ck,Zoo,5.0,San Antonio Zoo,https://lh5.googleusercontent.com/p/AF1QipN46hBc6Od1roqjQkrA1ZuMsjSIvDgLVn_3FcU=w150-h150-k-no-p,activity
"Not the best zoo I've been to (that honor currently rests with the Detroit Zoo), but still definitely worth seeing. It's somewhat small, but there's a wide variety of animals and my kids always love coming here.",ChdDSUhNMG9nS0VJQ0FnSUN5b1BYNm9nRRAB,"https://www.google.com/maps/place/San+Antonio+Zoo/@30.4786865,-105.8819976,6z/data=!4m6!3m5!1s0x865cf59ad8dd658d:0x29d4de62fd5bc2a4!8m2!3d29.4623904!4d-98.4737232!16s%2Fm%2F027j95d?hl=en",ChIJjWXd2Jr1XIYRpMJb_WLe1Ck,Zoo,4.0,San Antonio Zoo,https://lh5.googleusercontent.com/p/AF1QipPBSjiJkdYrv18jyWQYV8wXoX_O6dabfqi7vuvE=w150-h150-k-no-p,activity
"We are a family of zoo lovers, and although this is not our favorite zoo, you have to check it off your list. I highly encourage splurging on an animal encounter like the hippos. Even the extra $2 bird food is worth it to have a bird sit on your finger. You do have to stand in a long concession line to get it though. Unlike other zoos, you can't take coolers in there, but waters and small snacks are allowed. Our family did just fine in March with a meal before the zoo, snacks & water during, and a meal after.",ChdDSUhNMG9nS0VJQ0FnSUNZcXBYZXpBRRAB,"https://www.google.com/maps/place/San+Antonio+Zoo/@30.4786865,-105.8819976,6z/data=!4m6!3m5!1s0x865cf59ad8dd658d:0x29d4de62fd5bc2a4!8m2!3d29.4623904!4d-98.4737232!16s%2Fm%2F027j95d?hl=en",ChIJjWXd2Jr1XIYRpMJb_WLe1Ck,Zoo,5.0,San Antonio Zoo,https://lh5.googleusercontent.com/p/AF1QipN-3vB8jEfxI5cwNGGRnxzzGIj2zIQMiPGgP22f=w150-h150-k-no-p,activity
"Great local business, excellent prices, makes it easier to come here often and hit some balls.",ChdDSUhNMG9nS0VJQ0FnSURnd2JQZW9BRRAB,"https://www.google.com/maps/place/The+Practice+Golf+Center/@38.9124758,-85.092121,7z/data=!4m6!3m5!1s0x8834fb3b7eb7d68d:0x52a95d82d646b24!8m2!3d40.3039736!4d-79.9394266!16s%2Fg%2F1w6661vq?hl=en",ChIJjda3fjv7NIgRJGtkLdiVKgU,Golf driving range,5.0,The Practice Golf Center,https://lh5.googleusercontent.com/p/AF1QipM3jabJScgZV0dUVi9B_O9yVRxwpPDmCmYZOx5j=w150-h150-k-no-p,activity
Went to Westchester for lunch today.  I had the best french dip sandwich of my life.  The beef was a brisket that was absolutely stunning in terms of flavor and tenderness.,ChZDSUhNMG9nS0VJQ0FnSUN1ek5mbERnEAE,"https://www.google.com/maps/place/Westchester+Restaurant+and+Bar/@38.6621153,-90.6197749,8z/data=!4m6!3m5!1s0x87ded5e8aa00eb8d:0x9c21440ef0870d0e!8m2!3d38.6621153!4d-90.6197749!16s%2Fg%2F11rxrvkqqv?hl=en",ChIJjesAqujV3ocRDg2H8A5EIZw,Fine dining restaurant,5.0,Westchester Restaurant and Bar,https://lh5.googleusercontent.com/p/AF1QipP8ZeGVV-Z8R9C8D5szzguGSsqjT2MmMd5Jyp4i=w150-h150-k-no-p,restaurant
"Everything from start to finish was fantastic! The onion soup was flavorful and did not need the Gruyère cheese, but the cheese made it better. Perfect for a cold winter night! The steak tartare was also flavored well with peppers and the perfect ratio to the sauce. The chips made it even better. The duck breast matched well with the parsnip purée and was cooked to a perfect medium rare. The flavor profile had a gamier edge. The portion sizes were generous, and there were extra duck pieces mixed in with the vegetables. The cocktails were a delight: my old fashioned had a clear, custom cut ice cube that added to the aesthetic charm. The drink tasted better over time as the ice melted.

One of the owners, John, was so friendly; he came to check on our table to see how we were doing. I had a wonderful experience and will definitely come back!",ChZDSUhNMG9nS0VJQ0FnSURtMHZXUVpREAE,"https://www.google.com/maps/place/Westchester+Restaurant+and+Bar/@38.6621153,-90.6197749,8z/data=!4m6!3m5!1s0x87ded5e8aa00eb8d:0x9c21440ef0870d0e!8m2!3d38.6621153!4d-90.6197749!16s%2Fg%2F11rxrvkqqv?hl=en",ChIJjesAqujV3ocRDg2H8A5EIZw,Fine dining restaurant,5.0,Westchester Restaurant and Bar,https://lh5.googleusercontent.com/p/AF1QipNwvEex_4ejwFAfH1pfivH6INotyIHMxKjFDFv7=w150-h150-k-no-p,restaurant
"I’ll get right to it, order a bottle of wine when you go to Westchester, most wines by the glass starts at 20.00. My husband had the Wagyu steak and I ordered the salmon my whole dish was too salty, the wagyu was tough, 79.00 tough. Vegetable overcooked. Just because you slap high prices on a menu does not make it affluent or good. The server checked on us 11 times, she was such a sweet and pretty young lady, however,  needs to learn the art of being a server. #dissapointed Oh! The ice cream from Clementines was a delight! For those prices you should offer a Sommelier and better wine selection. The whole production of fine dining is to educate the diner and their experience should make them feel welcomed at your establishment. The hostess was not friendly at all. The decor dark and dreary. Those days of dark and dreary restaurants are outdated.",ChdDSUhNMG9nS0VJQ0FnSUR1M2VIMW13RRAB,"https://www.google.com/maps/place/Westchester+Restaurant+and+Bar/@38.6621153,-90.6197749,8z/data=!4m6!3m5!1s0x87ded5e8aa00eb8d:0x9c21440ef0870d0e!8m2!3d38.6621153!4d-90.6197749!16s%2Fg%2F11rxrvkqqv?hl=en",ChIJjesAqujV3ocRDg2H8A5EIZw,Fine dining restaurant,3.0,Westchester Restaurant and Bar,https://lh5.googleusercontent.com/p/AF1QipOvVhrqExbnlIJ5nmicEzE_GLAP5c_EwNJ6n1wh=w150-h150-k-no-p,restaurant
"My husband and I ate here on a weekend for dinner. You definitely need to make a reservation. Even during the week they are busy. If you are lucky you can try to get a seat at the bar.

Their cocktail list is excellent! Their drinks are priced similarly to Ruth Chris's $15+. The use quality fresh ingredients. I enjoyed their French 75.

I ordered the Waygu burger cooked medium rare with truffle fries which are fantastic. They sell it during their happy hour as well. We will be returning! Loved it!",ChdDSUhNMG9nS0VJQ0FnSUNoeGJIbGtBRRAB,"https://www.google.com/maps/place/Westchester+Restaurant+and+Bar/@38.6621153,-90.6197749,8z/data=!4m6!3m5!1s0x87ded5e8aa00eb8d:0x9c21440ef0870d0e!8m2!3d38.6621153!4d-90.6197749!16s%2Fg%2F11rxrvkqqv?hl=en",ChIJjesAqujV3ocRDg2H8A5EIZw,Fine dining restaurant,5.0,Westchester Restaurant and Bar,https://lh5.googleusercontent.com/p/AF1QipNuCgwr7lq6Vu2qlBTfMZZ1O7q1PHt1ddCCo6OF=w150-h150-k-no-p,restaurant
"I normally don't leave reviews but one of the best dining experiences I've had in a good while and I felt compelled. All I can say is that the food was excellent and while the prices were up there, the quality food and preparation was exactly what you would expect for a premium dining experience and are on par with their prices. Here's a picture of the Sea Bass. Perfectly cooked with an amazing presentation. Skin was crispy with the fish itself, succulent and juicy. Kudos to the Chef. Please continue to do what you are doing, I will definitely be back.",ChdDSUhNMG9nS0VJQ0FnSUNCbkwzYXhBRRAB,"https://www.google.com/maps/place/Westchester+Restaurant+and+Bar/@38.6621153,-90.6197749,8z/data=!4m6!3m5!1s0x87ded5e8aa00eb8d:0x9c21440ef0870d0e!8m2!3d38.6621153!4d-90.6197749!16s%2Fg%2F11rxrvkqqv?hl=en",ChIJjesAqujV3ocRDg2H8A5EIZw,Fine dining restaurant,5.0,Westchester Restaurant and Bar,https://lh5.googleusercontent.com/p/AF1QipOVGbTpPXFF54cJp49ypXovnyT2AIYmFDdwdqMy=w150-h150-k-no-p,restaurant
"Delicious! Sit at the bar, you won't be disappointed.",ChdDSUhNMG9nS0VJQ0FnSURPOHAyRGxRRRAB,"https://www.google.com/maps/place/Westchester+Restaurant+and+Bar/@38.6621153,-90.6197749,8z/data=!4m6!3m5!1s0x87ded5e8aa00eb8d:0x9c21440ef0870d0e!8m2!3d38.6621153!4d-90.6197749!16s%2Fg%2F11rxrvkqqv?hl=en",ChIJjesAqujV3ocRDg2H8A5EIZw,Fine dining restaurant,5.0,Westchester Restaurant and Bar,https://lh5.googleusercontent.com/p/AF1QipM8irqbTBjCiavCXYSOL1A1cCCuQE0eJs2EoeY3=w150-h150-k-no-p,restaurant
"I am torn.. . The food and drinks were 5 star. Service was slow, not just for us but noticeably for everyone around us. Maybe it is because they recently opened but the service didn't seem to have a solid flow.

I want to say the bar needs an additional person but with so few tables two should suffice. It is a shame they dont knock the wall down and expand the kitchen and dining room.

A few labeling mistakes on the menu. Orin swift hasnt made saldo in over a decade but the 2020 orin swift saldo is on the menu.",ChZDSUhNMG9nS0VJQ0FnSURXc09xWUlREAE,"https://www.google.com/maps/place/Westchester+Restaurant+and+Bar/@38.6621153,-90.6197749,8z/data=!4m6!3m5!1s0x87ded5e8aa00eb8d:0x9c21440ef0870d0e!8m2!3d38.6621153!4d-90.6197749!16s%2Fg%2F11rxrvkqqv?hl=en",ChIJjesAqujV3ocRDg2H8A5EIZw,Fine dining restaurant,3.0,Westchester Restaurant and Bar,https://lh5.googleusercontent.com/p/AF1QipOLpT5F8YJaEO-gQZhdap8tXPAXev2gid8mEe4t=w150-h150-k-no-p,restaurant
Five Star fine dining. Exceptional service. Expensive but worth the Date night ambience.,ChZDSUhNMG9nS0VJQ0FnSURodVp1ZU5REAE,"https://www.google.com/maps/place/Westchester+Restaurant+and+Bar/@38.6621153,-90.6197749,8z/data=!4m6!3m5!1s0x87ded5e8aa00eb8d:0x9c21440ef0870d0e!8m2!3d38.6621153!4d-90.6197749!16s%2Fg%2F11rxrvkqqv?hl=en",ChIJjesAqujV3ocRDg2H8A5EIZw,Fine dining restaurant,5.0,Westchester Restaurant and Bar,https://lh5.googleusercontent.com/p/AF1QipO2tkCLd7DMKQzVsjZRzg6LyfkDDRqm_R8Jt8M=w150-h150-k-no-p,restaurant
Lobster and smoked shrimp appetizer! It made my palate so happy!! Amazing!! Drinks superb and service fantastic!,ChZDSUhNMG9nS0VJQ0FnSURXbzY3Z01nEAE,"https://www.google.com/maps/place/Westchester+Restaurant+and+Bar/@38.6621153,-90.6197749,8z/data=!4m6!3m5!1s0x87ded5e8aa00eb8d:0x9c21440ef0870d0e!8m2!3d38.6621153!4d-90.6197749!16s%2Fg%2F11rxrvkqqv?hl=en",ChIJjesAqujV3ocRDg2H8A5EIZw,Fine dining restaurant,5.0,Westchester Restaurant and Bar,https://lh5.googleusercontent.com/p/AF1QipNpvZ2rrSUpT5OFbJ-UTbNPTTBkzE18R-_-1p9h=w150-h150-k-no-p,restaurant
"Great atmosphere, excellent customer service and amazing food…from the salads to the sandwiches, burgers & fries you can’t go wrong! Can’t sit to come back for dinner and drinks!",ChdDSUhNMG9nS0VJQ0FnSUNXc3RQRHZ3RRAB,"https://www.google.com/maps/place/Westchester+Restaurant+and+Bar/@38.6621153,-90.6197749,8z/data=!4m6!3m5!1s0x87ded5e8aa00eb8d:0x9c21440ef0870d0e!8m2!3d38.6621153!4d-90.6197749!16s%2Fg%2F11rxrvkqqv?hl=en",ChIJjesAqujV3ocRDg2H8A5EIZw,Fine dining restaurant,5.0,Westchester Restaurant and Bar,https://lh5.googleusercontent.com/p/AF1QipO1D3yS3lae8CLuxmBBGwwqg0dHlF_DhEIakf0f=w150-h150-k-no-p,restaurant
"It was early and we were the only ones in the dinning room for a good while before anyone else showed up. We had a pizza made which was sooo good. The salad bar is always delicious. We did run into some dried out chicken, which is usually juicey, but a little gravy helped bring it back. The server never prebussed and we had a stack of plates and trash sitting on oir table thru out our visit. Other then that, we LOVE Pizza Ranch and will continue stopping in when we see them!",ChZDSUhNMG9nS0VJQ0FnSURCNGEzVGNREAE,"https://www.google.de/maps/place/Pizza+Ranch/@42.4803875,-96.4189768,11z/data=!4m6!3m5!1s0x878dff094bb15b93:0x5329caf26168bfb4!8m2!3d42.3992598!4d-96.3617679!16s%2Fg%2F1td18bm3?hl=en",ChIJk1uxSwn_jYcRtL9oYfLKKVM,Buffet restaurant,4.0,Pizza Ranch,https://lh5.googleusercontent.com/p/AF1QipPiwUPbM81SQq0c-dpWavNw6LIwagnq8eWWrvZc=w150-h150-k-no-p,restaurant
We stopped at this establishment around 7 and the door was unlocked and we walked in. After we were all inside 2 voices yelled out we are closed. This is very unfortunate as this was the first time we was visiting this place and had to take our party of over 7 people to a different place.,ChdDSUhNMG9nS0VJQ0FnSUNCbTVLVDZRRRAB,"https://www.google.de/maps/place/Pizza+Ranch/@42.4803875,-96.4189768,11z/data=!4m6!3m5!1s0x878dff094bb15b93:0x5329caf26168bfb4!8m2!3d42.3992598!4d-96.3617679!16s%2Fg%2F1td18bm3?hl=en",ChIJk1uxSwn_jYcRtL9oYfLKKVM,Buffet restaurant,2.0,Pizza Ranch,https://lh5.googleusercontent.com/p/AF1QipPSyp49HCEOKXcuJWBvPGERkL_ZwZZjji6dx2_O=w150-h150-k-no-p,restaurant
"This is how $50 worth of pizza is delivered.

Update: after speaking with the manager, Paul, he was apologetic and applied a credit to our next order.",ChdDSUhNMG9nS0VJQ0FnSURlNkw3eHV3RRAB,"https://www.google.de/maps/place/Pizza+Ranch/@42.4803875,-96.4189768,11z/data=!4m6!3m5!1s0x878dff094bb15b93:0x5329caf26168bfb4!8m2!3d42.3992598!4d-96.3617679!16s%2Fg%2F1td18bm3?hl=en",ChIJk1uxSwn_jYcRtL9oYfLKKVM,Buffet restaurant,1.0,Pizza Ranch,https://lh5.googleusercontent.com/p/AF1QipP1vgCimu4r9V4Yt-OmWc9Kto3vWooQGD-jwbUL=w150-h150-k-no-p,restaurant
